Megalopolis,‚ÄòMegalopolis‚Äô Acquired by Studiocanal for European TV and SVOD Rights,"Studiocanal has bought European TV and SVOD rights to Francis Ford Coppola‚Äôs ‚ÄúMegalopolis‚Äù as part of a deal spanning seven years. The pact excludes Spain, Russia and pay 1 in France where ‚ÄúMegalopolis‚Äù was released by Le Pacte on Sept. 25 and has so far sold‚Ä¶",https://variety.com/2024/film/global/studiocanal-megalopolis-european-tv-svod-1236190594/,"Studiocanal has bought European TV and SVOD rights to Francis Ford Coppola‚Äôs ‚ÄúMegalopolis‚Äù as part of a deal spanning seven years. 
",,,
Megalopolis,‚ÄòMegalopolis‚Äô: Studiocanal Takes European TV & Streaming Rights,"Francis Ford Coppola‚Äôs Megalopolis has landed its latest international deal with Studiocanal taking European TV and streaming rights. The deal runs for seven years and excludes Spain, Russia and pay one France. It was struck at MIPCOM by Juliette Hochart of S‚Ä¶",http://deadline.com/2024/10/megalopolis-studiocanal-european-tv-streaming-rights-francis-ford-coppola-1236158266/,"Francis Ford Coppola‚Äòs Megalopolishas landed its latest international deal with Studiocanal taking European TV and streaming rights. 
",,,
Megalopolis,"I, Coppola","‚ÄúBeware of the clich√©, the predictable‚Äù: that‚Äôs one of the notes about storytelling that Francis Ford Coppola keeps posted where he works, as he reports in his book Live Cinema and Its Techniques.1 Watching Megalopolis‚ÄîCoppola‚Äôs first film in thirteen years, ‚Ä¶",https://www.nybooks.com/online/2024/11/03/i-coppola-megalopolis/,"‚ÄúBeware of the clich√©, the predictable‚Äù: that‚Äôs one of the notes about storytelling that Francis Ford Coppola keeps posted where he works, as he reports in his book Live Cinema and Its Techniques.1 W‚Ä¶ [+23377 chars]",,,
Megalopolis,Francis Ford Coppola‚Äôs ‚ÄòMegalopolis‚Äô Gets Digital Streaming Date,‚ÄúMegalopolis‚Äù‚ÄîFrancis Ford Coppola‚Äôs big-budget sci-fi epic‚Äîis coming soon to digital streaming. Find out when and where you can watch it at home.,https://www.forbes.com/sites/timlammers/2024/10/25/francis-ford-coppolas-megalopolis-gets-digital-streaming-date/,"""Megalopolis"" partial poster.
",,,
Megalopolis,"Francis Ford Coppola, Accepting DGA Honor From Granddaughter Gia, Revels In Break From ‚ÄòMegalopolis‚Äô Promotion","EXCLUSIVE: After spending months talking about his long-nurtured dream project, Megalopolis, Francis Ford Coppola embraced the chance to depart from promo tour talking points. Calling Megaloplis ‚Äúa great adventure,‚Äù Coppola affirmed with a smile in accepting ‚Ä¶",http://deadline.com/2024/10/francis-ford-coppola-dga-honors-megalopolis-1236120083/,"EXCLUSIVE: After spending months talking about his long-nurtured dream project, Megalopolis, Francis Ford Coppola embraced the chance to depart from promo tour talking points.
",,,
Megalopolis,China‚Äôs Hishow Acquires ‚ÄòMegalopolis‚Äô; Ramps Up Slate Of Prestige Festival Titles For China Release,"EXCLUSIVE: Chinese producer-distributor Hishow Entertainment has been on an acquisitions spree, snapping up several prestige festival titles for distribution in mainland China, including Francis Ford Coppola‚Äôs Megalopolis, which it plans to give a wide theatr‚Ä¶",http://deadline.com/2024/11/china-release-hishow-megalopolis-io-capitano-1236166048/,"EXCLUSIVE: Chinese producer-distributor Hishow Entertainment has been on an acquisitions spree, snapping up several prestige festival titles for distribution in mainland China, including Francis Ford‚Ä¶ [+3456 chars]",,,
Megalopolis,Francis Ford Coppola To Receive 50th AFI Life Achievement Award In April,"Megalopolis helmer Francis Ford Coppola is set to receive the American Film Institute‚Äôs 50th Life Achievement Award, AFI‚Äôs highest honor for a career in film, during a Gala Tribute at the Dolby Theatre in Los Angeles on April 26, 2025. Coppola is the latest i‚Ä¶",http://deadline.com/2024/10/francis-ford-coppola-set-afi-life-achievement-award-1236161354/,"Megalopolis helmer Francis Ford Coppola is set to receive the American Film Institute‚Äòs 50th Life Achievement Award, AFI‚Äôs highest honor for a career in film, during a Gala Tribute at the Dolby Theat‚Ä¶ [+1597 chars]",,,
Megalopolis,‚ÄòMegalopolis‚Äô Is a Spectacular Failure,"Francis Ford Coppola‚Äôs new film crumbles under its own absurd weight.
The post ‚ÄòMegalopolis‚Äô Is a Spectacular Failure¬† appeared first on The American Conservative.",https://www.theamericanconservative.com/megalopolis-is-a-spectacular-failure/,"The greatest sin an artist can commit is to allow time to pass them by unnoticed. Sadly, that is exactly what has happened to the legendary filmmaker Francis Ford Coppola. Somewhere along the way, th‚Ä¶ [+6881 chars]",,,
Megalopolis,Why Megalopolis Reviews Are So Divided,"Despite being a critically acclaimed filmmaker, Francis Ford Coppola's latest film, Megalopolis, has received mixed reviews at best.",https://screenrant.com/video/why-megalopolis-mixed-reviews-explained/,"Despite being a critically acclaimed filmmaker, Francis Ford Coppola's latest film, Megalopolis, has received mixed reviews at best.",,,
Megalopolis,"From Film School to Coppola With 'Megalopolis' DP Mihai Malaimare, Jr.","Mihai Malaimare Jr. has had a crazy career, spanning from PTA's The Master to Coppola's latest love letter to creativity. On our latest pod, he shares his journey from film school to working with legendary director Francis Ford Coppola, offering insights into‚Ä¶",https://nofilmschool.com/from-film-school-to-coppola-with-megalopolis-dp-mihai-malaimare-jr,"Peebles got her early introduction working in the film industry working as a prop master on small projects like Adult Swim's Delocated, working her way up to Set Decorating Oppenheimer, to working in‚Ä¶ [+9915 chars]",,,
Megalopolis,"Megalopolis Flopped in Theaters‚ÄîBut on TikTok, It‚Äôs a Hit",Francis Ford Coppola‚Äôs magnum opus will likely never recoup its $120 million price tag. Perhaps he can take comfort in his film‚Äôs thriving cult following.,https://www.vanityfair.com/hollywood/story/megalopolis-flopped-in-theaters-but-on-tiktok-its-a-hit,"X content
",,,
Megalopolis,"I Saw Megalopolis After It Was Roasted By Moviegoers And Critics, And I Don‚Äôt Think It Earns Its Negative Reputation",It's time for a great debate on Megalopolis' quality.,https://www.cinemablend.com/movies/saw-megalopolis-roasted-moviegoers-critics-dont-think-earns-negative-reputation-francis-ford-coppola,"Picture this, readers: a member of the 2024 movie schedule",,,
Megalopolis,Francis Ford Coppola Accused Of Kissing Underage Girl,"Child labor coodinator Benjamin Cawood claimed he saw Francis Ford Coppola kiss a 13-year old girl on the set of his film, ""Megalopolis.""",https://dailycaller.com/2024/10/14/francis-ford-coppola-kissing-minor-girl-megalopolis-set-variety-lawsuit/,"Child labor coodinator Benjamin Cawood claimed he saw Francis Ford Coppola kiss a 13-year old girl on the set of his film, ‚ÄúMegalopolis,‚Äù according to the Daily Beast.",,,
Megalopolis,Studio Slump: Lionsgate‚Äôs Last 6 Films Have All Been Box Office Busts,"‚ÄúBorderlands,‚Äù ‚ÄúMegalopolis‚Äù and ‚ÄúThe Crow‚Äù are among the failures to launch, and trouble lies ahead as ""Ballerina"" undergoes major reshoots
The post Studio Slump: Lionsgate‚Äôs Last 6 Films Have All Been Box Office Busts appeared first on TheWrap.",https://www.thewrap.com/lionsgate-box-office-slump-ballerina-reshoots/,"While much attention in the box office world has been on the catastrophic launch of Warners Joker: Folie a Deux, another new release this past weekend, White Bird, has deepened a two-month slump in t‚Ä¶ [+565 chars]",,,
Megalopolis,Francis Ford Coppola Named as AFI‚Äôs 50th Life Achievement Award Honoree,"The ""Megalopolis"" director will receive his honor at a Dolby Theatre gala tribute held in April 2025
The post Francis Ford Coppola Named as AFI‚Äôs 50th Life Achievement Award Honoree appeared first on TheWrap.",https://www.thewrap.com/francis-ford-coppola-afi-50th-life-achievement-award/,"Francis Ford Coppola has been named as AFIs 50th Life Achievement Award honoree, the institute revealed on Tuesday.",,,
Megalopolis,Why are Instagram searches for ‚ÄòAdam Driver Megalopolis‚Äô blocked for CSAM?,Meta‚Äôs Facebook and Instagram are blocking seemingly innocuous searches on the grounds that the terms used may be associated with child abuse imagery.,https://www.theverge.com/2024/10/19/24274467/instagram-facebook-meta-block-csam-adam-driver-megalopolis-mega-drive-content-moderation,"Why are Instagram searches for Adam Driver Megalopolis blocked for CSAM?
",,,
Megalopolis,Yemen launches drone attack against Israeli-linked ship in Arabian Sea,"The Yemeni Armed Forces have claimed responsibility for a drone attack on the ship ""MEGALOPOLIS"" in the Arabian Sea, media outlets reported.",https://www.globalsecurity.org/military/library/news/2024/10/mil-241019-irna05.htm,"IRNA - Islamic Republic News Agency
",,,
Megalopolis,Francis Ford Coppola‚Äôs Camp Masterpiece: Notes on Megalopolis,"I was too young to see Showgirls when it was released to theaters in 1995, but I was old enough to notice the media narrative surrounding the newest ‚Äúworst film of all time.‚Äù Paul Verhoeven‚Äôs NC-17 erotic melodrama was panned, mocked, reviled. Rita Kempley cl‚Ä¶",https://lithub.com/francis-ford-coppolas-camp-masterpiece-notes-on-megalopolis/,"I was too young to see Showgirls when it was released to theaters in 1995, but I was old enough to notice the media narrative surrounding the newest worst film of all time. Paul Verhoeven‚Äôs NC-17 ero‚Ä¶ [+17151 chars]",,,
Megalopolis,Design Authority,"There are no dentists in Francis Ford Coppola‚Äôs Megalopolis, much of which takes place at a lofty and ethereal architecture studio in the Chrysler Building‚Äôs tip.",https://www.nplusonemag.com/online-only/online-only/design-authority/,"Francis Ford Coppola (director). Megalopolis. 2024.In 1979 The Cloud Club, a swanky members-only dinner club at the three very top floors of the Chrysler Building, closed after fifty years under the ‚Ä¶ [+20658 chars]",,,
Megalopolis,2024 Academy Museum Gala: AGATHA ALL ALONG Star Aubrey Plaza in Miu Miu,"Aubrey, we love you, but you got Miu Miu‚Äôd hard for this one. The star of Megalopolis and Agatha All Along rode a wave of high attention as she hit the red carpet for the Academy Museum Gala (which is exactly the position you want to be in for industry events‚Ä¶",https://tomandlorenzo.com/2024/10/2024-academy-museum-gala-agatha-all-along-star-aubrey-plaza-in-miu-miu/,"Archives:¬†
",,,
Megalopolis,Daily Tech News 20 October 2024,"Top Story Why are Instagram and Facebook searches for ""Adam Driver Megalopolis"" being blocked for CSAM? (The Verge) Because (a) ""mega drive"" is a code word used by very bad people, and (b) Facebook is dumb....",https://acecomments.mu.nu/?post=411980,Daily Tech News 20 October 2024,,,
Megalopolis,Column: Everyone‚Äôs piling on ‚ÄòMegalopolis‚Äô and ‚ÄòJoker: Folie √† Deux.‚Äô They‚Äôre not the flops I worry about.,"Set aside for a moment what movies have made or lost money so far in 2024. Some big-budget sequels like ""Bad Boys: Ride or Die"" did well at the box office but were failures in my book.",https://www.bostonherald.com/2024/10/18/column-everyones-piling-on-megalopolis-and-joker-folie-a-deux-theyre-not-the-flops-i-worry-about/,"Set aside for a moment what movies have made or lost money so far in 2024. Some big-budget sequels like ""Bad Boys: Ride or Die"" did well at the box office but were failures in my book.",,,
Megalopolis,Oliver Stone praises Megalopolis as one of the extraordinary films he‚Äôs recently watched,"The Wall Street director is known for showing how power corrupts and would praise Coppola's fable about a society in conflict with those in power.
The post Oliver Stone praises Megalopolis as one of the extraordinary films he‚Äôs recently watched appeared first‚Ä¶",https://www.joblo.com/oliver-stone-megalopolis/,"The Wall Street director is known for showing how power corrupts and would praise Coppola‚Äôs fable about a society in conflict with those in power.
",,,
Megalopolis,"Saturday Night Movie Thread [moviegique]: The Bad and the Beautiful (Megalopolis, Joker 2 & more)","Just as I sometimes will avoid a movie that's too over-hyped, knowing that most movies can't live up to the buzz, I occasionally will see movies that everyone is dumping on, especially if there's some conflicting or interesting angle to...",https://acecomments.mu.nu/?post=412188,"Just as I sometimes will avoid a movie that's too over-hyped, knowing that most movies can't live up to the buzz, I occasionally will see movies that everyone is dumping on, especially if there's som‚Ä¶ [+52 chars]",,,
Megalopolis,"China‚Äôs police seize assets, demand payments amid economic downturn","washington ‚Äî¬†Zhang Ke, not his real name, has been hiding from police in the southern megalopolis of Guangzhou since September. He said he had not committed a crime but was dodging authorities to avoid extortion by police from another city more than 1,400 kil‚Ä¶",https://www.voanews.com/a/china-s-police-seize-assets-demand-payments-amid-economic-downturn-/7857592.html,"washington ¬†Zhang Ke, not his real name, has been hiding from police in the southern megalopolis of Guangzhou since September. He said he had not committed a crime but was dodging authorities to avoi‚Ä¶ [+5153 chars]",,,
Megalopolis,Clint Eastwood‚Äôs possible final film will only be in 50 theaters ‚Äî is it any good?,"It‚Äôs an injustice that duds like ‚ÄúJoker: Folie a Deux‚Äù and ‚ÄúMegalopolis‚Äù played on thousands of screens around the country while Clint Eastwood‚Äôs engrossing new film about justice, ‚ÄúJuror No. 2,‚Äù will only grace 50.",https://nypost.com/2024/11/01/entertainment/juror-no-2-review-94-year-old-clint-eastwoods-courtroom-drama-is-too-good-for-a-50-theater-run/,movie reviewRunning time: 113 minutes. Rated PG-13 (some violent images and strong language). In theaters.,,,
Deadpool & Wolverine,Ryan Reynolds Thinks Gambit Might Have Had His Deadpool Leak Moment,Channing Tatum's Deadpool & Wolverine role may have unlocked a big future for the character.,https://gizmodo.com/gambit-movie-chances-channing-tatum-deadpool-2000521657,"As Gambit said, he‚Äôs about to make a name for himself. Channing Tatum‚Äôs appearance in Deadpool &amp; Wolverine was one of the film‚Äôs biggest surprises, mostly because the actor had never played the c‚Ä¶ [+2055 chars]",,,
Deadpool & Wolverine,Marvel Reveals Deadpool & Wolverine‚Äòs Disney+ Release Date via Literal Toilet Humor,Deadpool & Wolverine will begin streaming on Disney+ November 12. See what they did there?,https://gizmodo.com/deadpool-and-wolverine-streaming-disney-plus-release-date-marvel-2000518301,"Marvel has finally revealed when Deadpool &amp; Wolverine is coming to Disney+. However, because this promo is related to the pottymouth humor of the film, Marvel went about revealing its November 12‚Ä¶ [+2356 chars]",,,
Deadpool & Wolverine,Deadpool & Wolverine Almost Gave Us a Surprising Kissing Scene,"No, it's not between Wade and Logan.",https://gizmodo.com/deadpool-wolverine-almost-gave-us-a-surprising-kissing-scene-2000510829,"If all the high-quality gifs running the mill on social media are any indication, Marvel fans worldwide are getting good use out of the home video release of Deadpool &amp; Wolverine by reminding peo‚Ä¶ [+2301 chars]",,,
Deadpool & Wolverine,Deadpool & Wolverine Just Got A Disney Plus Streaming Date And It's Not Far Away,"Deadpool & Wolverine proved that even if the MCU fatigue is real, comic book blockbusters can still be wildly successful if they involve the X-Men, two giant Hollywood stars, tons of jokes, a massive marketing budget, and little to no other meaningful competi‚Ä¶",https://kotaku.com/deadpool-wolverine-just-got-a-disney-plus-streaming-d-1851685637,"Deadpool &amp; Wolverine proved that even if the MCU fatigue is real, comic book blockbusters can still be wildly successful if they involve the X-Men, two giant Hollywood stars, tons of jokes, a mas‚Ä¶ [+1844 chars]",,,
Deadpool & Wolverine,Deadpool & Wolverine hits Disney Plus in two weeks,"Marvel‚Äôs Deadpool & Wolverine, a collision of the Fox X-Men universe and MCU proper, is the biggest hit of the year so far. In fact, 14 weeks after its premiere, it‚Äôs still in 300 theaters, scraping a few thousand bucks here and there to brings its grand box-‚Ä¶",https://www.polygon.com/marvel/472153/deadpool-wolverine-disney-plus-streaming-release-date,"Marvel‚Äôs Deadpool & Wolverine, a collision of the Fox X-Men universe and MCU proper, is the biggest hit of the year so far. In fact, 14 weeks after its premiere, it‚Äôs still in 300 theaters, scraping ‚Ä¶ [+1518 chars]",,,
Deadpool & Wolverine,When does Deadpool & Wolverine start streaming?,"After a record-setting run in theaters, Deadpool & Wolverine is finally heading to stream. Find out when the superhero film arrives on Disney+.",https://www.digitaltrends.com/movies/deadpool-wolverine-streaming-release-date-disney-plus/,"The biggest superhero movie is heading to streaming. Marvel Studios announced that Deadpool &amp; Wolverine¬†will begin streaming on Disney+ on November 12, 2024.",,,
Deadpool & Wolverine,"Hugh Jackman's Alternate Costume In Deadpool And Wolverine Cost $100,000","Marvel's superhero movies tend to be very expensive, and Deadpool & Wolverine was no exception with a reported $200 million budget. It's not unusual to wonder where all of that money is going, but we do know about $100,000 of that total went toward one of Hug‚Ä¶",https://www.gamespot.com/articles/hugh-jackmans-alternate-costume-in-deadpool-and-wolverine-cost-100000/1100-6527276/,"Marvel's superhero movies tend to be very expensive, and Deadpool &amp; Wolverine was no exception with a reported $200 million budget. It's not unusual to wonder where all of that money is going, bu‚Ä¶ [+1721 chars]",,,
Deadpool & Wolverine,'Deadpool and Wolverine' Receives Official Disney+ Streaming Premiere Date,"The highest-grossing R-rated movie of all time, Deadpool & Wolverine, is finally arriving on Disney+.The film's digital release is scheduled for November 12 and arrives with multiple viewing options across major streaming platforms. Fans can choose from sever‚Ä¶",https://hypebeast.com/2024/10/deadpool-and-wolverine-official-disney-streaming-premiere-date,"The highest-grossing R-rated movie of all time, Deadpool &amp; Wolverine, is finally arriving on Disney+.
",,,
Deadpool & Wolverine,Here Are the Incredible A-List Comic Book Cameos That Didn‚Äôt Make It Into ‚ÄòDeadpool & Wolverine‚Äô,Ryan Reynolds wanted these two superstars to return to their ill-fated comic book movie roles,https://www.cracked.com/article_44314_here-are-the-incredible-a-list-comic-book-cameos-that-didnt-make-it-into-deadpool-wolverine.html,"For all the incredible guest stars and forgotten characters whom Ryan Reynolds roped into the making of¬†Deadpool &amp; Wolverine, there are still a small handful of big gets who got away maybe they s‚Ä¶ [+3359 chars]",,,
Deadpool & Wolverine,Heroes & Villains Unveils New Weapon X Gear That Deadpool & Wolverine Fans Will Love [Exclusive],Heroes & Villains has a new Weapon X clothing and accessories collection that pays tribute to the experimental program that gave us Deadpool and Wolverine.,https://www.slashfilm.com/1684681/heroes-villains-weapon-x-collection-deadpool-wolverine-clothing-accessories/,"T-shirts are always a good option, but when the weather cools down, you're gonna need an extra layer. Rather than hiding your Deadpool and Wolverine fandom, you can suit up and keep warm with the Her‚Ä¶ [+2169 chars]",,,
Deadpool & Wolverine,Marvel's Deadpool & Wolverine Broke A Huge R-Rated Movie Record Held By John Wick,"Marvel's Deadpool & Wolverine has already broken records on digital, including one for R-rated films previously held by the John Wick franchise.",https://www.slashfilm.com/1686266/deadpool-wolverine-marvel-broke-r-rated-movie-record-vod-john-wick/,"While Marvel fans have understandably groused about the lack of a Disney+ release date for the film, it's not surprising that the studio would milk this cash cow for all it's worth. The movie arrived‚Ä¶ [+1548 chars]",,,
Deadpool & Wolverine,The Real Reason Marvel Cut Gambit's Deadpool & Wolverine Post-Credits Scene,A deleted Deadpool & Wolverine post-credits scene revealed that Channing Tatum's Gambit is still alive. Here's why Marvel dropped it from the theatrical cut.,https://www.slashfilm.com/1689085/marvel-cut-gambit-deadpool-and-wolverine-post-credits-scene-reason/,"""Deadpool &amp; Wolverine"" was so positively stuffed with Easter eggs, cameos, and the Merc with a Mouth's usual wanton hijinks that it's hardly surprising that some choice bits got left on the cutti‚Ä¶ [+1192 chars]",,,
Deadpool & Wolverine,"Are PVOD Rental Prices Going Up? ‚ÄòAlien: Romulus,‚Äô ‚ÄòThe Wild Robot,‚Äô ‚ÄòDeadpool & Wolverine‚Äô: All $24.99","'Alien: Romulus,' 'The Wild Robot,' and 'Deadpool & Wolverine' are all renting for $24.99, but 'Beetlejuice Beetlejuice' remains at $19.99.",https://www.indiewire.com/news/box-office/are-pvod-rental-prices-going-up-24-99-1235058839/,The big news in home movie viewing this week isn‚Äôt that new-to-PVOD ‚ÄúThe Wild Robot‚Äù (Universal) and ‚ÄúAlien: Romulus‚Äù (Disney) split the #1 positions on the iTunes and Fandango top 10 charts.,,,
Deadpool & Wolverine,‚ÄòBeetlejuice Beetlejuice‚Äô Upends ‚ÄòDeadpool & Wolverine‚Äô After One Week on PVOD,'Beetlejuice Beetlejuice' takes the top PVOD spot on iTunes and Fandango over 'Deadpool & Wolverine.' Read IndieWire's VOD box office report.,https://www.indiewire.com/news/box-office/beetlejuice-beetlejuice-pvod-overtakes-deadpool-and-wolverine-1235056741/,"The fiasco of ‚ÄúJoker: Folie √† Deux‚Äù is something that Warner Bros. can‚Äôt hide from ‚Äî other distributors question its officially reported $7 million gross for its second weekend, now #4 after initiall‚Ä¶ [+4432 chars]",,,
Deadpool & Wolverine,Ryan Reynolds Suggests That the Funniest Cameo in ‚ÄòDeadpool & Wolverine‚Äô Could Become An Entire Spin-off,Reynolds claimed that Disney is crazy about one of the forgotten comic book characters he brought back from development hell,https://www.cracked.com/article_44301_ryan-reynolds-suggests-that-the-funniest-cameo-in-deadpool-wolverine-could-become-an-entire-spin-off.html,"A nearly forgotten Marvel antihero might be about to make a name for himself here.
",,,
Deadpool & Wolverine,Deadpool & Wolverine Streaming Release Day Announced,,https://www.escapistmagazine.com/deadpool-wolverine-streaming-release-day-announced/,Marvel Studios has officially announced the streaming release date for Deadpool &amp; Wolverine on Disney+. It was back and forth there for a minute because the movie has been doing so well in theatr‚Ä¶ [+1787 chars],,,
Deadpool & Wolverine,‚ÄòDeadpool & Wolverine‚Äô Sets Disney+ Premiere Date,"After a record-smashing run in theaters worldwide over the summer, Marvel Studios‚Äô superhero flick Deadpool & Wolverine, teaming Ryan Reynolds‚Äô Merc with a Mouth and Hugh Jackman‚Äôs Adamantium-clawed Marvel mutant, has been set to begin streaming on Disney+ on‚Ä¶",http://deadline.com/2024/10/deadpool-wolverine-streaming-premiere-date-disney-plus-1236162086/,"After a record-smashing run in theaters worldwide over the summer, Marvel Studios‚Äò superhero flick Deadpool &amp; Wolverine, teaming Ryan Reynolds‚Äô Merc with a Mouth and Hugh Jackman‚Äôs Adamantium-cla‚Ä¶ [+1380 chars]",,,
Deadpool & Wolverine,Deadpool 3 Nearly Featured a Different Hero Making the Ultimate Sacrifice,"Deadpool & Wolverine's third act is already iconic, but it nearly featured a different Marvel hero making the ultimate sacrifice.",https://www.escapistmagazine.com/deadpool-3-nearly-featured-a-different-hero-making-the-ultimate-sacrifice/,"It‚Äôs been months since Deadpool &amp; Wolverine hit theaters, but the world is still buzzing about it. That probably has a lot to do with Ryan Reynolds, who is still sharing behind-the-scenes looks a‚Ä¶ [+1808 chars]",,,
Deadpool & Wolverine,Ryan Reynolds Explains Ghost Rider Absence in Deadpool & Wolverine,,https://www.escapistmagazine.com/ryan-reynolds-explains-ghost-rider-absence-in-deadpool-wolverine/,"It turns out that Nicolas Cage was almost in Deadpool &amp; Wolverine. They went very far, and it turned out that there was almost an appearance of Ghost Rider.
",,,
Deadpool & Wolverine,Martha Stewart Says Ryan Reynolds is Not so Funny in Real Life,"Ryan Reynolds is known for his often-humorous roles in movies like ""Deadpool & Wolverine,"" but he isn't so funny in real life, so says Martha Stewart. Martha was a guest on the ""Rent Free"" game show produced by Bilt Rewards, and she got into a‚Ä¶",https://www.tmz.com/2024/11/02/martha-stewart-ryan-reynolds-not-funny/,"Ryan Reynolds is known for his often-humorous roles in movies like ""Deadpool &amp; Wolverine,"" but he isn't so funny in real life, so says Martha Stewart.
",,,
