Joker: Folie √† Deux,Lady Gaga ‚Äì ‚ÄúDisease‚Äù,"Between starring in Joker: Folie √Ä Deux and releasing its companion album Harlequin, Lady Gaga has somehow found time to record more new music. (Harlequin is not the follow-up to 2020‚Äôs Chromatica; she has said that #7 is officially arriving in February. And ‚Ä¶",https://www.stereogum.com/2285317/lady-gaga-disease/music/,"Between starring in Joker: Folie √Ä Deux and releasing its companion album Harlequin, Lady Gaga has somehow found time to record more new music. (Harlequin is not the follow-up to 2020s Chromatica; sh‚Ä¶ [+932 chars]",Focus on Other Movies,Marketing and Promotion,
Joker: Folie √† Deux,Why has Joker: Folie √† Deux divided critics?,The sequel to Joker is 'staggeringly inept' in its attempts to explore mental health issues ‚Äì but Lady Gaga is 'magnetic',https://biztoc.com/x/3ea3663afc58d2a9,"The sequel to Joker is 'staggeringly inept' in its attempts to explore mental health issues but Lady Gaga is 'magnetic'
",Focus on Other Movies,Reception and Reviews,
Joker: Folie √† Deux,Has ‚ÄòJoker: Folie √Ä Deux‚Äôs‚Äô Digital Streaming Date Been Revealed?,"Joaquin Phoenix and Lady Gaga‚Äôs box office dud ""Joker: Folie A Deux"" appears to have digital streaming release date already. Find out when and where you can watch the movie at home.",https://www.forbes.com/sites/timlammers/2024/10/16/has-joker-folie--deuxs-digital-streaming-date-been-revealed/,"""Joker: Folie √† Deux"" partial poster.
",Focus on Other Movies,Marketing and Promotion,
Joker: Folie √† Deux,"Quentin Tarantino Praises ‚ÄòJoker: Folie √Ä Deux‚Äô & Todd Phillips, Calls Film A ‚ÄúF*** You‚Äù To Hollywood & Comic Book Fans",Quentin Tarantino is praising Todd Phillips and Joker: Folie √† Deux after the Warner Bros. film bombed at the box office. The Kill Bill director gave his thoughts on the Joaquin Phoenix and Lady Gaga-starring film and shared why he enjoyed the DC Comics-based‚Ä¶,http://deadline.com/2024/10/quentin-tarantino-praises-joker-folie-a-deux-todd-phillips-1236161514/,"Quentin Tarantino is praising Todd Phillips and Joker: Folie √† Deux after the Warner Bros. film bombed at the box office.
",Focus on Other Movies,Reception and Reviews,
Joker: Folie √† Deux,‚ÄòJoker: Folie √Ä Deux‚Äô To Debut On Digital Streaming This Week,"Joaquin Phoenix and Lady Gaga's movie misfire ""Joker: Folie √† Deux"" is debuting on digital streaming this week. Find out when and where you can watch the movie at home.",https://www.forbes.com/sites/timlammers/2024/10/26/joker-folie--deux-to-debut-on-digital-streaming-this-week/,"""Joker: Folie √† Deux"" partial poster. 
",Focus on Other Movies,Marketing and Promotion,
Joker: Folie √† Deux,‚ÄòTerrifier 3‚Äô Eyes Monster Box Office Opening As ‚ÄòJoker 2‚Äô Drops 82%,‚ÄúTerrifier 3‚Äù featuring Art the Clown is dominating the weekend box office while ‚ÄúJoker: Folie √† Deux‚Äù dives 82% in week two ticket sales.,https://www.forbes.com/sites/timlammers/2024/10/12/terrifier-3-eyes-monster-box-office-opening-as-joker-2-drops-82/,"David Howard Thornton in ""Terrifier 3.""",Focus on Other Movies,Box Office Performance,
Joker: Folie √† Deux,Lady Gaga Kicks Off ‚ÄòLG7‚Äô Era With Lead Single ‚ÄòDisease‚Äô,"Lady Gaga wasted no time in getting back to music following 'Joker: Folie √† Deux,' releasing ""Disease"" as the lead single from her upcoming seventh album.",https://www.forbes.com/sites/cmalone/2024/10/25/lady-gaga-kicks-off-lg7-era-with-lead-single-disease/,"Lady Gaga
",Focus on Other Movies,Marketing and Promotion,
Joker: Folie √† Deux,Dana Carvey Explains Why His ‚ÄòSNL‚Äô Lady Gaga Joke ‚ÄúDidn‚Äôt Land‚Äù,"Much like Joker: Folie √† Deux, Dana Carvey‚Äòs latest joke fell a little flat. As the Saturday Night Live alum continues his Season 50 run as President Joe Biden, Carvey reflected on the latest episode and a joke that ‚Äúdidn‚Äôt land‚Äù about Lady Gaga‚Äòs performance‚Ä¶",http://deadline.com/2024/10/dana-carvey-why-snl-lady-gaga-joke-didnt-land-1236159445/,"Much like Joker: Folie √† Deux, Dana Carvey‚Äòs latest joke fell a little flat.
",Focus on Other Movies,Reception and Reviews,
Joker: Folie √† Deux,‚ÄòJoker 2‚Äô Is Now Streaming‚ÄîHow To Watch The Blockbuster Flop At Home,"After a disappointing box office run, ""Joker: Folie √† Deux"" is now available to stream on digital platforms. Here's how to watch Joaquin Phoenix and Lady Gaga in ""Joker 2.""",https://www.forbes.com/sites/monicamercuri/2024/10/29/joker-2-is-now-streaming-how-to-watch-the-blockbuster-flop-at-home/,"Joker: Folie √† Deux
",Focus on Other Movies,Marketing and Promotion,
Joker: Folie √† Deux,‚ÄòJoker: Folie A Deux‚Äô Frowns With $165M WW After 2nd Weekend; ‚ÄòThe Wild Robot‚Äô Thrives And ‚ÄòDeadpool & Wolverine‚Äô Enters Top 20 All-Time Global Chart ‚Äì International Box Office,"Refresh for latest‚Ä¶: After its sadly disappointing start last weekend, Warner Bros and Todd Phillips‚Äô Joker: Folie √† Deux is still a sad clown, adding an estimated $22.7M from 77 international box office markets this session (a 70.5% drop). The overseas runni‚Ä¶",http://deadline.com/2024/10/joker-folie-a-deux-wild-robot-box-office-deadpool-wolverine-top-20-global-1236114527/,"Refresh for latest‚Ä¶: After its sadly disappointing start last weekend, Warner Bros and Todd Phillips‚Äô Joker: Folie √† Deux is still a sad clown, adding an estimated $22.7M from 77 international box of‚Ä¶ [+4226 chars]",Focus on Other Movies,Box Office Performance,
Joker: Folie √† Deux,"‚ÄòTerrifier 3‚Äô Jump Scares $2M+ Previews & 94% Rotten Tomatoes Audience Score, ‚ÄòJoker: Folie √† Deux‚Äô Ends First Week With Low $44.6M ‚Äì Box Office","Cineverse‚Äôs unrated slasher threequel Terrifier 3 grossed out $2.5M in previews on Thursday which began at 8PM. There‚Äôs speculation that this microbudget movie, which cost Cineverse under $5M in its entirety for acquisition and P&A, will topple Warner Bros‚Äô J‚Ä¶",http://deadline.com/2024/10/box-office-terrifier-3-joker-folie-a-deux-the-apprentice-1236113611/,"Cineverse‚Äôs unrated slasher threequelTerrifier 3 grossed out $2.5M in previews on Thursday which began at 8PM. There‚Äôs speculation that this microbudget movie, which cost Cineverse under $5M in its e‚Ä¶ [+2379 chars]",Focus on Other Movies,Box Office Performance,
Joker: Folie √† Deux,‚ÄòVenom: The Last Dance‚Äô Hopes To Make October Box Office Prance With $70M Opening ‚Äì Forecast,"With Warner Bros.‚Äô Joker: Folie √† Deux¬†bombing and this past weekend‚Äôs overall ticket sales being off 43% from the same period a year ago, the October box office might feel kind of sluggish. It‚Äôs at this point in time that we say, where are you Venom? A natio‚Ä¶",http://deadline.com/2024/10/venom-the-last-dance-box-office-projection-1236115760/,"With Warner Bros.‚Äô Joker: Folie √† Deux¬†bombing and this past weekend‚Äôs overall ticket sales being off 43% from the same period a year ago, the October box office might feel kind of sluggish.",Focus on Other Movies,Box Office Performance,
Joker: Folie √† Deux,Todd Phillips Wants Cinemas To Forgo Commercials Before Screening Movies: ‚ÄúWe‚Äôve Paid For Our Tickets‚Äù,Joker: Folie √† Deux director Todd Phillips has one solution to improve movie theaters: forgoing showing commercials ahead of a film‚Äôs screening. Speaking to Empire magazine as part of a filmmakers‚Äô poll on what the future of movies and entertainment would loo‚Ä¶,http://deadline.com/2024/11/todd-phillips-movie-theaters-commercials-1236165531/,"Joker: Folie √† Deux director Todd Phillips has one solution to improve movie theaters: forgoing showing commercials ahead of a film‚Äôs screening.
",Focus on Other Movies,Broader Industry Trends,
Joker: Folie √† Deux,"Well, At Least Quentin Tarantino Liked Joker: Folie √† Deux","The dismal box office performance didn't bother the Oscar-winning director, who claims he ""really, really liked"" the film. 
Well, At Least Quentin Tarantino Liked Joker: Folie √† Deux
Mary Siroky",https://consequence.net/2024/10/quentin-tarantino-joker-folie-a-deux/,"Joker: Folie √† Deux, the follow-up to 2019‚Äôs Oscar-winning¬†Joker, has become one of the biggest box-office bombs in modern movie histoy. But despite the terrible critical and commercial reception tha‚Ä¶ [+1821 chars]",Focus on Other Movies,Reception and Reviews,
Joker: Folie √† Deux,Joker: Folie √† Deux Projected to Lose Up to $200 Million at Box Office,"The sequel is poised to lose between $125 million and $200 million during its theatrical run, according to industry insiders.
Joker: Folie √† Deux Projected to Lose Up to $200 Million at Box Office
Eddie Fu",https://consequence.net/2024/10/joker-folie-a-deux-200-million-box-office-loss/,"Joker: Folie √† Deux looks poised to be a massive box office flop, according to projections from industry insiders.
",Focus on Other Movies,Box Office Performance,
Joker: Folie √† Deux,Joker: Folie √Ä Deux Hits Digital Platforms On October 29th,"Well, this is not exactly a good sign. It's becoming more and more apparent that Warner Bros. has a massive flop on its hands with Joker: Folie √Ä Deux. It's one thing for critics to hate your movie, but audiences are rejecting it just as hard. The critic and ‚Ä¶",https://bleedingcool.com/movies/joker-folie-a-deux-hits-digital-platforms-on-october-29th/,"Posted in: Joker, Movies, Warner Bros | Tagged: Joker: Folie √† Deux
",Focus on Other Movies,Marketing and Promotion,
Joker: Folie √† Deux,Every Joker (2019) Character That Returns in the Sequel,"Joker: Folie √† Deux has plenty of new characters, but a few cast members from 2019's Joker return in the sequel.",https://screenrant.com/video/joker-2019-characters-returns-in-sequel/,"Joker: Folie √† Deux has plenty of new characters, but a few cast members from 2019's Joker return in the sequel.",Focus on Other Movies,Cast and Crew,
Joker: Folie √† Deux,Lady Gaga Unveils Dynamic New Song ‚ÄúDisease‚Äù: Stream,"A pivot back to pop music after last month's jazz effort inspired by her character in Joker: Folie √† Deux. 
Lady Gaga Unveils Dynamic New Song ‚ÄúDisease‚Äù: Stream
Mary Siroky and Jo Vito",https://consequence.net/2024/10/lady-gaga-disease-new-song-stream/,"The Mother Monster is back. Lady Gaga has shared a new song, ‚ÄúDisease,‚Äù that offers a return to the peak pop form that put her on the map. Stream it below.
",Focus on Other Movies,Marketing and Promotion,
Joker: Folie √† Deux,Batman Actor Calls Out Joker 2's Twist Ending,One of the actors to have played Batman in live-action calls out the massive and controversial twist ending to Todd Phillips' Joker: Folie √† Deux.,https://screenrant.com/batman-joker-2-ending-call-out-gotham-david-mazouz/,"A former Batman actor gives their thoughts on Joker: Folie √† Deuxwhile calling out the way the DC sequel ended Arthur Fleck's story.
",Focus on Other Movies,Reception and Reviews,
Joker: Folie √† Deux,Joker: Folie √† Deux Will Release On 4K Blu-ray December 17th,"Joker: Folie √† Deux¬†has been a polarizing film, to say the least, since its debut in theaters last week, and we already have news on when you can pick up a physical copy to own. The Todd Phillips film will get a 4K Blu-ray release on December 17th. There is n‚Ä¶",https://bleedingcool.com/movies/joker-folie-a-deux-4k-blu-ray-release-december-17th-steelbook/,"Posted in: 4K/Blu-Ray, Movies | Tagged: Joker: Folie √† Deux, lady gaga, steelbook",Focus on Other Movies,Marketing and Promotion,
Joker: Folie √† Deux,Enjoy This Amusing Pitch Meeting For JOKER: FOLIE √Å DEUX,"We‚Äôve got a funny new Pitch Meeting video to share with you today, and it amusingly imagines what the pitch meeting for Joker: Folie √Ä Deux was like. While Joker was a huge hit for WB, Joker: Folie √Ä Deux ended up being a huge disappointment. There were so ma‚Ä¶",https://geektyrant.com/news/enjoy-this-amusing-pitch-meeting-for-joker-folie-deux,"Weve got a funny new Pitch Meeting video to share with you today, and it amusingly imagines what the pitch meeting for Joker: Folie √Ä Deuxwas like. 
",Focus on Other Movies,Production and Behind-the-Scenes,
Joker: Folie √† Deux,‚ÄòJoker 2‚Äô Sprints To Screens At Home This Month After A Laughable Reception,"If you‚Äôre still on the fence about whether to catch Joker: Folie √† Deux before it leaves theaters, worry not. Warner Bros is dancing to a different tune as its musical take on Gotham‚Äôs clown prince faces the music‚Äîthe studio has announced an unusually swift d‚Ä¶",https://community.designtaxi.com/topic/5948-joker-2-to-sprint-to-screens-at-home-this-month-after-a-laughable-reception/,"If youre still on the fence about whether to catch Joker: Folie √† Deux before it leaves theaters, worry not. Warner Bros is dancing to a different tune as its musical take on Gothams clown prince fac‚Ä¶ [+1184 chars]",Focus on Other Movies,Marketing and Promotion,
Joker: Folie √† Deux,"Terrifier 3 Tops Box Office With $18M, Joker: Folie √† Deux Collapses With Brutal 81% Drop","Terrifier 3 slashed its way to No. 1 in North America, collecting a stellar $18.3 million from 2,514 theaters in its opening weekend. It's a huge start for the ultra-gory, independently made, low-budget slasher film about a demonic clown who brutalizes a smal‚Ä¶",https://www.adweek.com/morning-media-newsfeed/terrifier-3-tops-box-office-with-18m-joker-folie-a-deux-collapses-with-brutal-81-drop/,"Terrifier 3 slashed its way to No. 1 in North America, collecting a stellar $18.3 million from 2,514 theaters in its opening weekend. Its a huge start for the ultra-gory, independently made, low-budg‚Ä¶ [+1192 chars]",Focus on Other Movies,Box Office Performance,
Joker: Folie √† Deux,"‚ÄòTerrifier 3‚Äô tops box office with $18 million debut, ‚ÄòJoker: Folie √† Deux‚Äô collapses with brutal 81% drop",There‚Äôs only room for one killer clown at the top of box office charts.,https://www.nbcnews.com/pop-culture/pop-culture-news/terrifier-3-tops-box-office-18-million-debut-joker-folie-a-deux-collap-rcna175241,"Theres only room for one killer clown at the top of box office charts.
",Focus on Other Movies,Box Office Performance,
Joker: Folie √† Deux,Why has Joker: Folie √† Deux divided critics?,The sequel to Joker is 'staggeringly inept' in its attempts to explore mental health issues ‚Äì but Lady Gaga is 'magnetic',https://theweek.com/culture-life/film/why-has-joker-folie-a-deux-divided-critics,"Five years ago, the American writer-director Todd Phillips (until then best known for the Vegas-set comedy ""The Hangover"") won widespread acclaim for ""Joker"", a dark origin story about Arthur Fleck, ‚Ä¶ [+1998 chars]",Focus on Other Movies,Reception and Reviews,
Joker: Folie √† Deux,"Terrifier, the indie horror film that managed to make 10x its budget while Joker: Folie √† Deux flails in the water, is getting a videogame",My hopes are not high.,https://www.pcgamer.com/games/horror/terrifier-the-indie-horror-film-that-managed-to-make-10x-its-budget-while-joker-folie-a-deux-flails-in-the-water-is-getting-a-videogame/,"Terrifier is a horror series that centres around a demonic serial killer clown called Art, who is still causing havoc in Miles County after three films and counting. The third film (which is currentl‚Ä¶ [+2242 chars]",Focus on Other Movies,Box Office Performance,
Joker: Folie √† Deux,TAXI DRIVER Writer Paul Schrader Offers His Brutally Honest Thoughts on JOKER: FOLIE √Ä DEUX,"As Joker: Folie √† Deux continues to die at the box office, screenwriter Paul Schrader (Taxi Driver) comes in kicking the film while it‚Äôs down by sharing his brutally honest thoughts on it. The movie hasn‚Äôt really connected with critics or fans. While director‚Ä¶",https://geektyrant.com/news/taxi-driver-writer-paul-schrader-offers-his-brutally-honest-thoughts-on-joker-folie-deux,"As Joker: Folie √† Deux continues to die at the box office, screenwriter Paul Schrader (Taxi Driver) comes in kicking the film while its down by sharing his brutally honest thoughts on it. 
",Focus on Other Movies,Reception and Reviews,
Joker: Folie √† Deux,'All In The First Take': Behind The Scenes of 'Joker: Folie √Ä Deux' With The Cinematographer,Oscar-nominated 'Joker' cinematographer joins ReelBlend!,https://www.cinemablend.com/podcasts/all-in-the-first-take-behind-the-scenes-joker-folie-a-deux-cinematographer-lawrence-sher,"This week, ReelBlend is joined by Oscar-nominated cinematographer Lawrence Sher to discuss his incredible work on ""Joker: Folie √† Deux,"" starring Joaquin Phoenix and Lady Gaga. He shares the story of‚Ä¶ [+844 chars]",Focus on Other Movies,Production and Behind-the-Scenes,
Moana 2,7 Things Every Disney Fan Needs To Know About Moana 2,"/Film visited Walt Disney Animation Studios for an early preview of Moana 2, and we've broken down everything you need to know about the anticipated sequel.",https://www.slashfilm.com/1698176/moana-2-things-every-disney-fan-should-know-about-sequel/,"""Moana 2"" is heading our way faster than you belt out ""AND NO ONE KNOOOOWS, HOW FAR IT GOOOOES!"" and we have some details on what you can expect about the highly-anticipated animated sequel from Walt‚Ä¶ [+1328 chars]",Focus on Other Movies,Marketing and Promotion,
Moana 2,"November Might Debut Four $100 Million-Plus Movies, Led by ‚ÄòWicked,‚Äô ‚ÄòGladiator 2,‚Äô and ‚ÄòMoana 2‚Äô",The November movie box office could yield four $100 million-plus titles including 'Wicked' and 'Gladiator 2.' And after a lame October.,https://www.indiewire.com/news/box-office/wicked-gladiator-2-november-box-office-1235061054/,"The projections game for November‚Äôs U.S./Canada box office is easier than next Tuesday‚Äôs election. But after October results far off earlier predictions, some caution is advisable
",Focus on Other Movies,Box Office Performance,
Moana 2,"‚ÄòFlow,‚Äô ‚ÄòMemoir of a Snail‚Äô Win Big at 7th Annual Animation Is Film Festival","The festival also included a sneak peek at ""Moana 2,"" a special screening of ""The Day the Earth Blew Up,"" and more.",https://www.indiewire.com/awards/results/animation-is-film-20204-winners-flow-memoir-of-a-snail-1235059080/,"The 7th Annual Animation Is Film Festival wrapped up with the announcement that Gints Zilbalodis‚Äô ‚ÄúFlow‚Äù took the Grand Prize, while ‚ÄúMemoir of a Snail‚Äù won the Special Jury Prize and tied with ‚ÄúThe ‚Ä¶ [+3662 chars]",Focus on Other Movies,Marketing and Promotion,
Moana 2,‚ÄòMoana 2‚Äô Sneak Peek: Disney‚Äôs Unprecedented Transition from Series to Feature for an Epic Sequel,"The filmmakers of ""Moana 2"" tell IndieWire how the scope of the intended series cried out for the big screen and how they expanded the titular character's arc for a more epic journey.",https://www.indiewire.com/features/animation/moana-2-sneak-peek-tv-series-to-epic-movie-interview-1235059918/,"With ‚ÄúMoana 2‚Äù (November 27), Disney Animation made the unprecedented move to expand its TV spinoff originally intended for Disney+ into a movie sequel. This made total sense, especially in light of ‚Ä¶ [+5695 chars]",Focus on Other Movies,Production and Behind-the-Scenes,
Moana 2,‚ÄòMoana 2‚Äô To Catch A Big Wave Over Thanksgiving With Potential $100M+ 5-Day Opening; $75M+ 3-Day ‚Äì Box Office Early Look,"EXCLUSIVE: Disney‚Äôs Moana 2 landed on long-lead tracking this morning and it‚Äôs looking to do $100M+ over its Wednesday through Sunday opening, $75M-$82M of that during its Friday-Sunday portion. These figures come from tracking service Quorum. The first Moana‚Ä¶",http://deadline.com/2024/10/moana-2-box-office-projection-1236120216/,"EXCLUSIVE: Disney‚Äôs Moana 2landed on long-lead tracking this morning and it‚Äôs looking to do $100M+ over its Wednesday through Sunday opening, $75M-$82M of that during its Friday-Sunday portion. These‚Ä¶ [+2313 chars]",Focus on Other Movies,Box Office Performance,
Moana 2,Everything We Know About ‚ÄòMoana 2‚Äô So Far,"Disney‚Äôs Moana will be cresting new waves in November with an another animated adventure. The young Wayfinder will have some new and familiar faces alongside her as she takes on a new mission from the ancestors, which brings her across the seas of Oceania, ac‚Ä¶",http://deadline.com/feature/moana-2-news-everything-we-know-1236169143/,"Disney‚Äôs Moana will be cresting new waves in November with an another animated adventure.
",Focus on Other Movies,Marketing and Promotion,
Moana 2,‚ÄòMoana 2‚Äô ‚ÄúCould Eclipse‚Äù ‚ÄòInside Out 2‚Äô At The Box Office: What AMC Boss Adam Aron Heard,"Despite the sluggishness of the fall box office with the bombing of Joker: Folie a Deux and the flat-footed star of Venom: The Last Dance, the holiday frames are coming up roses, specifically Disney‚Äôs Moana 2 could help fuel the year along with Wicked and Muf‚Ä¶",http://deadline.com/2024/11/moana-2-inside-out-2-box-office-record-amc-1236169513/,"Despite the sluggishness of the fall box office with the bombing of Joker: Folie a Deux and the flat-footed star of Venom: The Last Dance, the holiday frames are coming up roses, specifically Disney‚Äô‚Ä¶ [+1482 chars]",Focus on Other Movies,Box Office Performance,
Moana 2,Incoming Thanksgiving Tidal Wave At The Box Office: ‚ÄòMoana 2‚Äô Surfing To $135M Holiday Record Opening,"As we told you recently, Disney‚Äôs Moana 2 is heading to the best five-day opening ever at the Thanksgiving box office. We gave the six-weekend projection from Quorum, and this morning tracking service NRG ‚Äî which reports three-weekend-out forecasts ‚Äî is sayin‚Ä¶",http://deadline.com/2024/11/moana-2-thanksgiving-record-1236170067/,"As we told you recently, Disney‚Äòs Moana 2is heading to the best five-day opening ever at the Thanksgiving box office. We gave the six-weekend projection from Quorum, and this morning tracking service‚Ä¶ [+1776 chars]",Focus on Other Movies,Box Office Performance,
Moana 2,MOANA 2‚Äôs Filmmakers Talk Expanding the Magic and Adventure of the First Film,"The filmmakers behind Moana 2 talk about doing justice to the modern Disney animated classic, plus the sequel's story, characters, and more.
The post MOANA 2‚Äôs Filmmakers Talk Expanding the Magic and Adventure of the First Film appeared first on Nerdist.",https://nerdist.com/article/moana-2-filmmakers-preview-disney-sequel-movie-story-animation-characters/,"Eight years ago, Walt Disney Animation Studios released Moana, The story of a young Polynesian girl whom the ocean itself chose to embark on a dangerous adventure. Moana had to return the lost heart ‚Ä¶ [+8043 chars]",Focus on Other Movies,Production and Behind-the-Scenes,
Moana 2,Dive Into Adventure with All-New ‚ÄòMoana 2‚Äô Inspired Products,"We‚Äôre back! Get ready to embark on an all-new adventure as everyone‚Äôs favorite wayfinding heroine returns in Walt Disney Animation Studios‚Äô highly anticipated theatrical sequel, Moana 2, sailing into theaters on November 27. This time, Moana will journey to t‚Ä¶",https://disneyparksblog.com/products/dive-into-adventure-with-all-new-moana-2-inspired-products/,"We‚Äôre back!
",Focus on Other Movies,Marketing and Promotion,
Moana 2,"Jimmy O. Yang, Dolly De Leon, Utkarsh Ambudkar, ‚ÄòMoana 2‚Äô Team Among Honorees Set For Critics Choice AAPI Celebration Event","The Critics Choice Association on Thursday revealed its full list of honorees for the organization‚Äôs third annual Celebration of AAPI Cinema & Television, recognizing standout performances and work by the AAPI entertainment community. The event is set for Nov‚Ä¶",http://deadline.com/2024/10/critics-choice-celebration-of-aapi-cinema-television-2024-honorees-list-1236157504/,"The Critics Choice Association on Thursday revealed its full list of honorees for the organization‚Äôs third annual Celebration of AAPI Cinema &amp; Television, recognizing standout performances and wo‚Ä¶ [+1701 chars]",Focus on Other Movies,Cast and Crew,
Moana 2,Every God & Demigod In The Moana Movies,"Moana introduced some gods and demigods inspired by Polynesian mythology and history, and now Moana 2 introduces even more of these deities.",https://screenrant.com/moana-gods-demigods-characters/,"Gods and demigods are important to the story of Moana, and this continues into Moana 2. The 2024 sequel to the 2016 Disney movie returns to the hero of Motunui three years after her journey across th‚Ä¶ [+8783 chars]",Focus on Other Movies,Plot and Themes,
Moana 2,Moana 2: Special Look And New Poster Have Been Released,"Disney has their own horse in the November box office race, but they probably have the closest thing to a guaranteed winner out of the many big releases. To this day,¬†Moana¬†continues to do numbers over on Disney+, and this sequel kind of came out of nowhere. ‚Ä¶",https://bleedingcool.com/movies/moana-2-special-look-and-new-poster-have-been-released/,"Posted in: Disney, Movies | Tagged: moana 2",Focus on Other Movies,Marketing and Promotion,
