Movie,Article Title,Description,URL,Content,Movie_Topic_Kevin, Article_Topic_Kevin, Article Topic
Conclave,"In the Vatican Movie Conclave, Big Secrets Are Revealed. Here Are Three Real Life Papal Conclaves Marked by Controversy",Conclave is a fictional movie about a controversial papal conclave. Here's a look at three real papal conclaves that were controversial.,https://time.com/7098621/real-life-papal-conclave-controversies/,"After the death of a pope, the conclave of cardinals that meets to elect his successor are sworn to secrecy. As a result, the proceedings, which traditionally take place in the Vaticans Sistine Chape‚Ä¶ [+5406 chars]",Focus on Other Movies,Plot and Themes,
Conclave,The Best New Movies of October 2024,From Conclave to Anora.,https://time.com/7160762/best-new-movies-october-2024/,"In October, Oscar season begins in earnestthat means some of the years finest movies have already rolled out. Heres a selection of the months best, including one picture that will most certainly be a‚Ä¶ [+4953 chars]",Focus on Other Movies,Broader Industry Trends,
Conclave,"When the Pope Dies, the Cardinals Get Catty","In ""Conclave,"" Vatican City isn‚Äôt immune to election-season absurdity.",https://www.theatlantic.com/culture/archive/2024/10/conclave-film-review/680450/,"Early in the film Conclave, cardinals from around the world descend upon Vatican City after the death of the pope. Dressed in their scarlet vestments, they head to their guest rooms. A montage shows ‚Ä¶ [+5891 chars]",Focus on Other Movies,Reception and Reviews,
Conclave,Conclave Author Robert Harris on the Origin of His Best-Selling Vatican Thriller and Its Stunning Twist,The buzzy Vatican thriller chronicles how the election of a new pope turns into a fight for the soul of the modern-day Catholic Church.,https://time.com/7095853/conclave-robert-harris-interview/,"Warning: This post contains spoilers for Conclave.
",Focus on Other Movies,Plot and Themes,
Conclave,‚ÄòConclave‚Äô Is Some Truly Nutty Pope Fiction,"Ralph Fiennes leads an all-star cast in this thriller about cardinal sins, sinning cardinals and the sort of sheer campiness that will have you yelling ""Holy Shit!""",http://www.rollingstone.com/tv-movies/tv-movie-reviews/conclave-review-ralph-fiennes-1235138436/,"The Pope is dead. For years, his Holiness had helped to move the Catholic church toward modernity and serving its constituents in a manner befitting the 21st century. Now, however, ‚Äúthe throne of the‚Ä¶ [+5287 chars]",Focus on Other Movies,Reception and Reviews,
Conclave,"Conclave Review: Ralph Fiennes Leads A Satisfying, Mature Thriller Set Inside The Vatican","Ralph Fiennes stars as a conflicted Cardinal in Conclave, a sturdy, mature thriller about dark secrets within the Vatican. Here's our review.",https://www.slashfilm.com/1693553/conclave-ralph-fiennes-movie-review/,"""Conclave"" is full of secrets and conspiracies, but mercifully never approaches Dan¬†Brown levels of dumb ridiculousness. There will be no code-cracking or delving into tombs in ""Conclave"" (although t‚Ä¶ [+1891 chars]",Focus on Other Movies,Reception and Reviews,
Conclave,"‚ÄòConclave‚Äô Screenwriter Peter Straughan on That Wild Ending, and Why ‚ÄòThe Goldfinch‚Äô Movie Was ‚Äòa Mistake from the Beginning‚Äô","""Conclave"" spoilers ahead! Straughan breaks down with IndieWire how the movie arrives at its twist ending ‚Äî while expressing regrets about his past project, a critically loathed Donna Tartt adaptation.",https://www.indiewire.com/features/interviews/conclave-ending-explained-screenwriter-movie-wild-twist-1235062062/,"Editor‚Äôs Note: The following story contains major spoilers for the movie ‚ÄúConclave,‚Äù now in theaters.
",Focus on Other Movies,Plot and Themes,
Conclave,Edward Berger Elevates Papal Potboiler ‚ÄòConclave‚Äô Into an Oscar Contender ‚Äî Here‚Äôs How,"Speaking to IndieWire, the Oscar winner explains how he executed Robert Harris' bestselling thriller with able support from Ralph Fiennes, Stanley Tucci and Sergio Castellitto.",https://www.indiewire.com/features/interviews/how-edward-berger-turns-conclave-into-oscar-contender-1235059152/,"When ‚ÄúAll Quiet on the Western Front‚Äù director Edward Berger first read Peter Straughan‚Äôs script for ‚ÄúConclave,‚Äù his adaptation of the 2016 Robert Harris papal bestseller, it wasn‚Äôt the nasty cardina‚Ä¶ [+9018 chars]",Focus on Other Movies,Cast and Crew,
Conclave,"‚ÄòVenom: The Last Dance‚Äô Falls Short, but Look at ‚ÄòConclave‚Äô and ‚ÄòAnora‚Äô Soar","At $51 million, ""Venom"" is nothing like the disappointment of 'Joker 2,' but another superhero disappointment adds to theater worries.",https://www.indiewire.com/news/box-office/box-office-venom-the-last-dance-fell-short-conclave-anora-soar-1235060472/,"‚ÄúVenom: The Last Dance‚Äù (Sony), the final film in the Marvel trilogy starring Tom Hardy, will gross around $175 million worldwide through this weekend. At an estimated $51 million domestic, it provid‚Ä¶ [+7166 chars]",Focus on Other Movies,Box Office Performance,
Conclave,‚ÄòConclave‚Äô & ‚ÄòThe Brutalist‚Äô Among Titles Added To Camerimage Lineup,Edward Berger‚Äôs latest Conclave and Brady Corbet‚Äôs much-talked-about epic The Brutalist are among the titles that have been added to this year‚Äôs Camerimage Film Festival lineup.¬† Joining those titles is Vermiglio by Maura Delpero. Vermiglio debuted at this ye‚Ä¶,http://deadline.com/2024/10/conclave-the-brutalist-vermiglio-camerimage-film-festival-2024-1236157098/,"Edward Berger‚Äôs latest Conclave and Brady Corbet‚Äôs much-talked-about epic The Brutalist are among the titles that have been added to this year‚Äôs Camerimage Film Festival lineup.¬†
",Focus on Other Movies,Marketing and Promotion,
Conclave,Trailer #2 for 'Conclave' Pope Thriller w/ Ralph Fiennes & Stanley Tucci,"""Why did the Holy Father in his last official act as Pope choose me to run this conclave?"" Focus Features has unveiled the second trailer for the film Conclave, a papacy thriller from director Edward Berger, also of the Oscar-winner All Quiet on the Western F‚Ä¶",https://www.firstshowing.net/2024/trailer-2-for-conclave-pope-thriller-with-ralph-fiennes-stanley-tucci/,"by Alex BillingtonOctober 10, 2024Source:YouTube",Focus on Other Movies,Marketing and Promotion,
Conclave,In praise of the ‚Äúmiddlebrow‚Äù movie,"For all its serious subject matter, there‚Äôs something deeply comforting about a movie like Conclave. Edward Berger‚Äôs new mystery thriller, about a cardinal (Ralph Fiennes) assigned with overseeing the election of a new pope, is surprisingly juicy and a lot mo‚Ä¶",https://www.vox.com/culture/382672/conclave-challengers-trap-it-ends-with-us-movies,"For all its serious subject matter, theres something deeply comforting about a movie like Conclave. Edward Bergers new mystery thriller, about a cardinal (Ralph Fiennes) assigned with overseeing the ‚Ä¶ [+10984 chars]",Focus on Other Movies,Reception and Reviews,
Conclave,"Isabella Rossellini on Playing the Eyes and Ears of ‚ÄòConclave,‚Äô Her Curtsy Moment, and Why She‚Äôs Not a ‚ÄòBankable Actor‚Äô","The great Rossellini tells IndieWire about playing a not-so-subservient nun in her biggest Oscar contender in years, the glory of shooting at Cinecitt√†, and why her ""heart beat very fast"" around Ralph Fiennes.",https://www.indiewire.com/features/interviews/isabella-rossellini-conclave-curtsy-playing-nun-interview-1235059721/,"The great actress Isabella Rossellini was the face of Lanc√¥me beauty for more than a decade beginning in the early 1980s, but strangely, if you look back, rarely is she the lead in any of her iconic ‚Ä¶ [+12391 chars]",Focus on Other Movies,Cast and Crew ,
Conclave,"It‚Äôs Time for Ralph Fiennes‚Äô Third Oscar Nomination: The Actor on ‚ÄòConclave,‚Äô Playing Odysseus, and Danny Boyle‚Äôs ‚Äô28 Years Later‚Äô","Give the respected British actor his third Oscar nomination ‚Äî and first in three decades since ""The English Patient"" and ""Schindler's List.""",https://www.indiewire.com/features/interviews/ralph-fiennes-interview-conclave-28-years-later-the-return-1235059941/,"Can a great actor be taken for granted? 
",Focus on Other Movies,Cast and Crew,
Conclave,‚ÄòConclave‚Äô: Electoral Fight for Christianity‚Äôs Future,The new film ‚ÄòConclave‚Äô isn‚Äôt about selecting a new president; it‚Äôs about selecting a new pope. But the parallels are obvious and intentional.,https://www.thegospelcoalition.org/article/conclave-christian-movie-review/,"The release of Conclave mere weeks before the U.S. presidential election is no accident. This is a movie about the high-stakes, contentious selection process of a new leader at a time of widening pol‚Ä¶ [+9926 chars]",Focus on Other Movies,Plot and Themes,
Conclave,Producer Ashok Amritraj to Receive Indian Cinematic Icon Honor (EXCLUSIVE) ‚Äì Global Bulletin,MOGUL‚ÄôS MARCH International film producer Ashok Amritraj will be honored with the Global Indian Cinematic Icon Award at the upcoming India International Film Tourism Conclave in Mumbai. The ceremony will host diplomatic representatives from more than 50 natio‚Ä¶,https://variety.com/2024/film/asia/ashok-amritraj-indian-cinematic-icon-honor-1236186260/,International film producer Ashok Amritraj will be honored with the Global Indian Cinematic Icon Award at the upcoming India International Film Tourism Conclave in Mumbai. The ceremony will host dipl‚Ä¶ [+2614 chars],Does Not Mention Emilia P√©rez,Cultural Impact,
Conclave,Santa Barbara Film Festival Awards: Ralph Fiennes Set As Performer Of The Year For ‚ÄòConclave‚Äô,"Ralph Fiennes, who currently stars in Focus Features‚Äô awards-season drama Conclave from Edward Berger, has been selected to receive the¬†Outstanding Performer of the Year Award¬†at the 40th Santa Barbara Film Festival. Fiennes will be honored during a ceremony ‚Ä¶",http://deadline.com/2024/10/2025-santa-barbara-film-festival-awards-list-1236162348/,"Ralph Fiennes, who currently stars in Focus Features‚Äô awards-season drama Conclavefrom Edward Berger, has been selected to receive the¬†Outstanding Performer of the Year Award¬†at the 40th Santa Barbar‚Ä¶ [+1187 chars]",Focus on Other Movies,Cast and Crew,
Conclave,‚ÄòConclave‚Äô Director Edward Berger Didn‚Äôt See The Oscar Chatter Coming,"Ralph Fiennes delivers a powerhouse performance in this thriller, which also stars Stanley Tucci, John Lithgow, and Isabella Rossellini and is being devoured by audiences.",https://www.forbes.com/sites/simonthompson/2024/10/24/conclave-director-edward-berger-didnt-see-the-oscar-chatter-coming/,"Ralph Fiennes stars as Cardinal Lawrence in 'Conclave.'
",Focus on Other Movies,Cast and Crew,
Conclave,"Conclave is slick, unserious ‚Äî and verging on great","Conclave is a silly film masquerading as serious social commentary ‚Äî a sort of Mean Girls in robes, juggling a seemingly impactful message that instantly shatters into a thousand little pieces the moment you actually start to examine it. It's also quite good.",https://www.cbc.ca/news/entertainment/conclave-review-1.7362868,"Conclave is a bit too big for its britches.¬†
",Focus on Other Movies,Reception and Reviews,
Conclave,"Older Demos, Still Elusive, Bless ‚ÄòConclave‚Äô Amid Indie Surge ‚Äì Specialty Box Office","Four top films this weekend are indies ‚Äì five including The Substance at no. 11, as the specialty market roars back to life. No. 3 at the domestic box office is a great story, Conclave from Focus Features, the studio behind the Downtown Abbey films. excels at‚Ä¶",http://deadline.com/2024/10/conclave-older-moviegoers-theaters-indie-film-box-office-1236159448/,"Four top films this weekend are indies ‚Äì five including The Substance at no. 11, as the specialty market roars back to life. No. 3 at the domestic box office is a great story, Conclave from Focus Fea‚Ä¶ [+4730 chars]",Focus on Other Movies,Box Office Performance,
Conclave,"Breaking Baz: Edward Berger Says Ralph Fiennes Puts British ‚ÄúInscrutability‚Äù At The Heart Of ‚ÄòConclave‚Äô, And The Role Couldn‚Äôt Have Been Played By An Italian Actor",EXCLUSIVE: Filmmaker Edward Berger says that Ralph Fiennes‚Äô sublime performance as the cardinal charged with overseeing the election of a new pope in awards-season contender¬†Conclave¬†has a ‚Äúwhisper‚Äù of the inscrutability Anthony Hopkins displayed in his portr‚Ä¶,http://deadline.com/2024/10/edward-berger-conclave-ralph-fiennes-british-inscrutability-1236122454/,EXCLUSIVE: Filmmaker Edward Berger says that Ralph Fiennes‚Äô sublime performance as the cardinal charged with overseeing the election of a new pope in awards-season contender¬†Conclave¬†has a ‚Äúwhisper‚Äù ‚Ä¶ [+10177 chars],Focus on Other Movies,Cast and Crew,
Conclave,‚ÄòMemoir Of A Snail‚Äô & ‚ÄòConclave‚Äô Debut; A Soft-Side-Of-Donald-Trump Doc Takes On ‚ÄòThe Apprentice‚Äô ‚Äì Specialty Preview,"Indie releases from limited (Memoir of a Snail) to wide (Conclave) are testing an increasingly lively specialty box office heading into awards season with a handful of decorated documentaries this week including Dahomey, Black Box Diaries, My Name Is Alfred H‚Ä¶",http://deadline.com/2024/10/indie-films-opening-memoir-of-a-snail-conclave-donald-trump-documentary-1236158741/,Indie releases from limited (Memoir of a Snail) to wide (Conclave) are testing an increasingly lively specialty box office heading into awards season with a handful of decorated documentaries this we‚Ä¶ [+12535 chars],Focus on Other Movies,Cast and Crew,
Conclave,"Jesse Eisenberg, Kieran Culkin Drive ‚ÄòA Real Pain‚Äô To Top 3 Limited Opening As Audiences Dig Diverse Indie Slate ‚Äì Specialty Box Office",The independent film fall festival love affair with moviegoers continues with A Real Pain posting the year‚Äôs third best per screen average. Anora continues its standout run as does Conclave. The Ralph Fiennes-starring Vatican thriller is no. 4 at the box offi‚Ä¶,http://deadline.com/2024/11/indie-film-box-office-a-real-pain-anora-conclave-1236165664/,The independent film fall festival love affair with moviegoers continues with A Real Pain posting the year‚Äôs third best per screen average. Anora continues its standout run as does Conclave. The Ralp‚Ä¶ [+3489 chars],Focus on Other Movies,Box Office Performance ,
Conclave,"‚ÄòConclave‚Äô Screenwriter Peter Straughan Talks Adapting Robert Harris‚Äô Bestseller, Season 2 Of ‚ÄòWolf Hall‚Äô And Bringing The Beatles‚Äô George Harrison To The Screen","Over the past 20 years, screenwriter Peter Straughan has become British cinema‚Äôs go-to guy for adaptations. That might sound like a back-handed compliment, but his protean talent makes it hard to pinpoint what exactly constitutes a typical project for the UK-‚Ä¶",http://deadline.com/2024/10/conclave-screenwriter-peter-straughan-robert-harris-interview-1236144662/,"Over the past 20 years, screenwriter Peter Straughan has become British cinema‚Äôs go-to guy for adaptations. That might sound like a back-handed compliment, but his protean talent makes it hard to pin‚Ä¶ [+15070 chars]",Focus on Other Movies,Production and Behind-the-Scenes,
Conclave,Where To Watch Conclave: Showtimes & Streaming Status,"Following rave reviews for Ralph Fiennes' pope thriller, here are the options for where to watch Conclave in theaters, on streaming, or on digital.",https://screenrant.com/where-to-watch-conclave-showtimes-streaming/,"The initial reception to Conclave earned rave reviews out of the Telluride Film Festival in 2024, and the status quo did not change after a Toronto International Film Festival screening. With a 93% F‚Ä¶ [+2308 chars]",Focus on Other Movies,Marketing and Promotion,
Conclave,Conclave Review: The Picking of a Pope Becomes Fascinating Viewing ‚Äî Seriously,"The captivating quasi-thriller features Ralph Fiennes and Stanley Tucci as Cardinals caught up in a catty battle for power. 
Conclave Review: The Picking of a Pope Becomes Fascinating Viewing ‚Äî Seriously
Liz Shannon Miller",https://consequence.net/2024/10/conclave-review-ralph-fiennes-pope/,"Conclave begins with a death, but while the Ralph Fiennes-starring movie isn‚Äôt a murder mystery, director Edward Berger‚Äôs follow-up to 2022‚Äôs All Quiet on the Western Front almost treats it that way.‚Ä¶ [+5132 chars]",Focus on Other Movies,Plot and Themes,
Conclave,The Twist Ending of Conclave Wasn‚Äôt Meant to Shock You,"As director Edward Berger tells Vanity Fair in a spoiler-filled conversation, if you‚Äôre fixated on his film‚Äôs unexpected reveal, you‚Äôve missed the point: ‚ÄúIt‚Äôs not a takedown of the church.‚Äù",https://www.vanityfair.com/hollywood/story/conclave-movie-ending-spoilers-edward-berger-interview,"No, for me it really needs to end on Ralph thinking, this is kind of beautiful. Ralph in his room, all you hear is the hum of the fluorescent light, his breath, hes sequestered, theres no sunlight, n‚Ä¶ [+2963 chars]",Focus on Other Movies,Plot and Themes,
Conclave,Conclave Ending: The Chosen Popes Shocking Twist Explained By Director,Conclave director Edward Berger explains the significance of the film's final twist regarding the appointment of Cardinal Benitez as Pope.,https://screenrant.com/conclave-ending-explained-director/,Warning: The following article contains MAJOR SPOILERS for Conclave.Conclave director Edward Berger pulls back the curtain on the significance of its final twist. The Ralph Fiennes-starring Catholic ‚Ä¶ [+5861 chars],Focus on Other Movies,Plot and Themes,
Conclave,Not Everyone Needs To Agree: Conclave Director Responds To Audiences Reaction & Potential Controversy To Shocking Ending,Director Edward Berger directly addresses the potential controversy surrounding the bold ending of his latest political thriller Conclave.,https://screenrant.com/conclave-movie-controversial-ending-director-response/,"Warning! Spoilers below for Conclave!
",Focus on Other Movies,Reception and Reviews,
Conclave,Conclave Explained: How A New Pope Is Chosen,"The new film Conclave surrounds the fictional election of a new pope. Here's how the real-life process works, and how accurate the movie is.",https://screenrant.com/conclave-new-pope-chosen-how-explained/,"The film Conclavedepicts the election process of a new pope, and the film ornaments its terrifically acted drama with serious attention to the real-life process. Ralph Fiennes leads Conclave's cast a‚Ä¶ [+6891 chars]",Focus on Other Movies,Production and Behind-the-Scenes,
Conclave,Ralph Fiennes Joins Carlos Diehz & Isabella Rossellini at 'Conclave' Premiere in NYC,Ralph Fiennes is stepping out for the premiere of his new movie! The 61-year-old Oscar-nominated actor joined co-stars Carlos Diehz and Isabella Rossellini on the red carpet at the premiere of Conclave on Wednesday night (October 23) in New York City. Also in‚Ä¶,https://www.justjared.com/2024/10/23/ralph-fiennes-joins-carlos-diehz-isabella-rossellini-at-conclave-premiere-in-nyc/,"Ralph Fiennes is stepping out for the premiere of his new movie!
",Focus on Other Movies,Cast and Crew,
Conclave,John Lithgow Answers the Proust Questionnaire,"The six-time Emmy winner, who can currently be seen in ‚ÄòConclave,‚Äô on joyous Democrats, arboreal reincarnation, and tall-people problems.",https://www.vanityfair.com/hollywood/story/john-lithgow-proust-questionnaire,"What is your idea of perfect happiness? Creating something and feeling proud of it.
",Focus on Other Movies,Cast and Crew,
Conclave,‚ÄòAnora‚Äô Proves There‚Äôs Plenty of Life in the Awards Box Office,"Along with ‚ÄòThe Substance‚Äô and ‚ÄòConclave,‚Äô festival darlings are actually turning great reviews into commercial success‚Äîdespite other contenders struggling to gain traction.",https://www.vanityfair.com/hollywood/story/anora-conclave-substance-box-office-awards-insider,"Those invested in the commercial viability of adult, complex, ambitious filmmaking tend to experience post-COVID box-office reports like a rollercoaster. Every year, some of the most heavily marketed‚Ä¶ [+2555 chars]",Focus on Other Movies,Box Office Performance,
Conclave,Ralph Fiennes' 2024 Mystery Thriller Is One Of His Best-Rated Movies On Rotten Tomatoes As Star Is Getting Strong Oscar Buzz,Ralph Fiennes' 2024 mystery thriller Conclave is one of his best-rated movies on Rotten Tomatoes and is getting the actor strong Oscar buzz.,https://screenrant.com/conclave-rotten-tomatoes-score-ralph-fiennes/,"Conclave, the upcoming religious-focused mystery thriller starring Ralph Fiennes, is receiving high praise from critics and is earning the actor early Oscar buzz for his performance. The film follows‚Ä¶ [+2760 chars]",Focus on Other Movies,Reception and Reviews,
Conclave,Conclave Ending: What The Turtle & Laughing Nuns Really Mean Explained By Star,"Conclave stars Ralph Fiennes and Isabella Rossellini explain the ending of the movie, specifically the symbolism of the turtle and the laughing nuns.",https://screenrant.com/conclave-movie-ending-turtle-nuns-meaning-explained-ralph-fiennes/,"Warning: SPOILERS ahead for Conclave (2024)!Conclavestars Ralph Fiennes and Isabella Rossellini have explained the ending of the religious movie, specifically the symbolism of the turtle and the laug‚Ä¶ [+3982 chars]",Focus on Other Movies,Plot and Themes,
Conclave,"Stanley Tucci Takes Nothing for Granted: ‚ÄúAfter ‚ÄòThe Devil Wears Prada,‚Äô I Couldn‚Äôt Get a Job‚Äù","In a career-spanning conversation, the beloved actor who‚Äôs experienced decades of ups and downs in Hollywood reflects on hitting his sweet spot‚Äîwhich is somewhere between the film Conclave and his next big food show.",https://www.vanityfair.com/hollywood/stanley-tucci-conclave-little-gold-men-awards-insider,"Bellini tries to maintain his morality amid so much chaos and so many power plays. I would think its an interesting acting challenge, to hold on to that sense of moral authority and feel it slipping ‚Ä¶ [+1795 chars]",Focus on Other Movies,Cast and Crew,
Conclave,‚ÄòHe‚Äôs The Witness‚Äô: Conclave‚Äôs Ralph Fiennes Had An Unexpected But Important Approach In The Catholic Church-Centric Thriller,The actor's Conclave role afforded him a special opportunity.,https://www.cinemablend.com/interviews/conclave-ralph-fiennes-unexpected-but-important-approach-catholic-church-centric-thriller,"Director Edward Berger‚Äôs Conclave is a fascinating thriller. The story centers on cardinals of the Catholic Church gathering in Vatican City to elect a new pope, and though the religious organization‚Ä¶ [+2662 chars]",Focus on Other Movies,Cast and Crew,
Conclave,Intense New Trailer for Ralph Fiennes' Religious Thriller CONCLAVE,"Focus Features has released a new trailer for its dramatic religious thriller Conclave, which has a great cast that includes Ralph Fiennes, Stanley Tucci, John Lithgow, and Isabella Rossellini. This looks like quite an intense movie! The film is an adaptation‚Ä¶",https://geektyrant.com/news/intense-new-trailer-for-ralph-fiennes-religious-thriller-conclave,"Focus Features has released a new trailer for its dramatic religious thriller Conclave, which has a great cast that includes Ralph Fiennes, Stanley Tucci, John Lithgow, and Isabella Rossellini. This ‚Ä¶ [+1362 chars]",Focus on Other Movies,Marketing and Promotion,
Conclave,Oscars contender Conclave makes London debut,Stars attend the UK premiere of the drama about a scheming group of cardinals who select the new Pope.,https://www.bbc.com/news/articles/cqlvzw16xx4o,"The film's stars Ralph Fiennes, Isabella Rossellini and Stanley Tucci attened its London premiere
",Focus on Other Movies,Marketing and Promotion,
Conclave,The 11 Best Movies and TV Shows to Watch This Weekend,"The best movies and on TV to watch this weekend include ‚ÄòVenom: The Last Dance,‚Äô ‚ÄòConclave,‚Äô ‚ÄòLonglegs‚Äô back in movie theaters, and more. We‚Äôve got options!",http://www.vulture.com/article/what-to-watch-this-weekend-best-movies-tv-shows-october-25-27.html,"The College of Cardinals, roommate vampires, Venom, and Bruce Springsteen come together, and the thing they have in common? Well, theyre all in movies or shows that are out to watch this weekend. Thi‚Ä¶ [+3731 chars]",Focus on Other Movies,Broader Industry Trends,
Conclave,"Ralph Fiennes on choosing acting roles: ""I like characters that have contradictions inside them""","The Oscar-nominated actor starring in two new films ‚Äì ""Conclave"" and ""The Return"" ‚Äì talks about the draw of playing characters with contradictions, and the thrill of finding a new role.",https://www.cbsnews.com/news/ralph-fiennes-on-conclave-the-return/,"In the new film ""Conclave,"" based on the Robert Harris novel, Ralph Fiennes is a Vatican insider, the cardinal tasked with running the gathering of the entire College of Cardinals in Rome to select a‚Ä¶ [+5389 chars]",Focus on Other Movies,Cast and Crew,
