Juror #2,Juror #2: Clint Eastwood's 'cleverly constructed' courtroom drama is 'rock solid',Nicholas Hoult stars in 'morally complex' film about a juror on a high-profile murder case,https://theweek.com/culture-life/film/juror-2-clint-eastwoods-cleverly-constructed-courtroom-drama-is-rock-solid,"""What are the chances, eh?"" said Ryan Gilbey in The Guardian. ""First you get picked for jury duty even though your pregnant wife might deliver your child before you can deliver a verdict."" Then, you ‚Ä¶ [+1861 chars]",Focus on Other Movies,Reception and Reviews,
Juror #2,Clint Eastwood‚Äôs Juror #2 Is Out. But Can You Watch It?,Clint Eastwood's legal thriller 'Juror #2' stars Nicholas Hoult and could be the 94-year-old director and icon's final movie. Here's how you can watch.,https://www.menshealth.com/entertainment/a62785734/how-to-watch-juror-2-clint-eastwood/,"ONE OF THE biggest legends in movie history is putting out what may just be his final filmbut you may not be able to see it just yet. Clint Eastwood's 40th film as a director, Juror #2, hits theaters‚Ä¶ [+2663 chars]",Focus on Other Movies,Marketing and Promotion,
Juror #2,Why Did Warner Bros. Bury Clint Eastwood‚Äôs New Movie?,"Why did Warner Bros. bury Clint Eastwood‚Äôs new movie? ‚ÄòJuror #2‚Äô made it to just 28 cinemas. ‚ÄúMoney is all that matters to Zas,‚Äù one Hollywood exec confides. ‚ÄúHis bean counters know that Clint‚Äôs movies don‚Äôt bring in money anymore.‚Äù",http://www.vulture.com/article/why-did-warner-bros-bury-clint-eastwoods-juror-2.html,"What is it like to be directed by 94-year-old Clint Eastwood? There are certain givens on an Eastwood set: He doesnt say Action or Cut (instead, he quietly utters Okay from amid the cluster of playba‚Ä¶ [+8459 chars]",Focus on Other Movies,Broader Industry Trends,
Juror #2,Jonathan Abrams Wrote ‚ÄòJuror #2‚Äô in the Tradition of Clint Eastwood‚Äôs ‚ÄòMystic River‚Äô ‚Äî Then Eastwood Agreed to Direct It,Jonathan Abrams talks about writing 'Juror #2' as a tribute to Clint Eastwood's 'Mystic River' and then working with Eastwood himself.,https://www.indiewire.com/features/interviews/juror-2-screenwriter-jonathan-abrams-clint-eastwood-1235063573/,"Growing up in San Francisco, screenwriter Jonathan Abrams revered one Bay Area filmmaker especially.
",Focus on Other Movies,Production and Behind-the-Scenes,
Juror #2,Clint Eastwood skips premiere of new film 'Juror #2',"The stars of Clint Eastwood's new movie &quot;Juror #2&quot; paid glowing tributes to &quot;the boss,&quot; even as the 94-year-old director notably skipped the Hollywood world premiere of what could be his final film. &quot;Juror #2,&quot; out Friday, is a s‚Ä¶",https://japantoday.com/category/entertainment/clint-eastwood-skips-premiere-of-new-film-%27juror-2%27,"The stars of Clint Eastwood's new movie ""Juror #2"" paid glowing tributes to ""the boss,"" even as the 94-year-old director notably skipped the Hollywood world premiere of what could be his final film.
‚Ä¶ [+2404 chars]",Focus on Other Movies,Marketing and Promotion,
Juror #2,Nicholas Hoult credits Clint Eastwood with performance in ‚ÄúJuror #2:‚Äù ‚ÄòCatching lightning in a bottle‚Äô,In Clint Eastwood courtroom drama ‚ÄúJuror #2‚Äù Hoult‚Äôs a tormented juror in a high-profile murder trial in a case with more twists than any pretzel.,https://www.bostonherald.com/2024/10/31/nicholas-hoult-credits-clint-eastwood-with-performance-in-juror-2-catching-lightning-in-a-bottle/,"With three major films before year‚Äôs end, this season is peak career time for for Nicholas Hoult.
",Focus on Other Movies,Cast and Crew,
Juror #2,"Zoey Deutch, Leslie Bibb and Toni Collette at the AFI Fest Premiere of JUROR #2","Zoey Deutch, Leslie Bibb and Toni Collette, the stars of Juror #2, stepped out onto the red carpet at the AFI Fest premiere, making it very clear to all that they didn‚Äôt remotely coordinate their looks. ¬† We‚Äôre thinking there‚Äôs no group text for this cast. ¬† ‚Ä¶",https://tomandlorenzo.com/2024/10/zoey-deutch-leslie-bibb-and-toni-collette-at-the-afi-fest-premiere-of-juror-2/,"Archives:¬†
",Focus on Other Movies,Cast and Crew,
Juror #2,"In Juror #2, Clint Eastwood Puts American Justice on Trial",The famed filmmaker's likely final film is an exploration of the jury system and its flaws.,https://reason.com/2024/11/01/in-juror-2-clint-eastwood-puts-american-justice-on-trial/,"What is justice?¬† For as long as Clint Eastwood has been making movies‚Äîwhich is to say, a very long time‚Äîthat question has occupied him more than any other. In 1973's High Plains Drifter, he told the‚Ä¶ [+4602 chars]",Focus on Other Movies,Plot and Themes,
Juror #2,Juror #2 Review: Clint Eastwood tells a sturdy morality tale,"Nicholas Hoult stars as a juror who is much too close to the case he‚Äôs judging. 
The post Juror #2 Review: Clint Eastwood tells a sturdy morality tale appeared first on JoBlo.",https://www.joblo.com/juror-2-review-clint-eastwood-tells-a-sturdy-morality-tale/,"Nicholas Hoult stars as a juror who is much too close to the case hes judging. 
",Focus on Other Movies,Reception and Reviews,
Juror #2,‚ÄúJuror #2‚Äù Nearly Went Streaming Only,"Last week came the news that Warner Bros. Pictures was giving Clint Eastwood‚Äôs new film ‚ÄúJuror #2‚Äù only a rather limited theatrical run ‚Äì less than 50 theaters when it debuts on November 1st. In addition, there is no planned wide expansion rollout. It was sur‚Ä¶",https://www.darkhorizons.com/juror-2-nearly-went-streaming-only/,Last week came the news that Warner Bros. Pictures was giving Clint Eastwood‚Äôs new film ‚ÄúJuror #2‚Äù only a rather limited theatrical run ‚Äì less than 50 theaters when it debuts on November 1st. In addi‚Ä¶ [+1607 chars],Focus on Other Movies,Plot and Themes,
Juror #2,‚ÄúJuror #2‚Äù To Expand To 46 Screens,"Clint Eastwood‚Äôs ‚ÄúJuror #2‚Äù opened in cinemas last weekend, but you would hardly know it. Warner Bros. Pictures released the film with little promotion and into just 31 theaters domestically, despite getting a strong 92% (7.2/10) score on Rotten Tomatoes. In ‚Ä¶",https://www.darkhorizons.com/juror-2-to-expand-to-46-screens/,"Clint Eastwood‚Äôs ‚ÄúJuror #2‚Äù opened in cinemas last weekend, but you would hardly know it.",Focus on Other Movies,Cast and Crew,
Juror #2,Eastwood‚Äôs ‚ÄúJuror #2‚Äù Going Limited Only?,"Warner Bros. Pictures is reportedly set to give Clint Eastwood‚Äôs new film ‚ÄúJuror #2‚Äù only a rather limited theatrical run. Empire City (via World of Reel) broke the news, saying the title will hit less than 50 theaters with ‚Äúno marketing support‚Äù on November ‚Ä¶",https://www.darkhorizons.com/eastwoods-juror-2-going-limited-only/,Warner Bros. Pictures is reportedly set to give Clint Eastwood‚Äôs new film ‚ÄúJuror #2‚Äù only a rather limited theatrical run.,Focus on Other Movies,Marketing and Promotion,
Juror #2,MOVIES: Juror #2 - Justice for Clint Eastwood,,https://www.spoilertv.com/2024/11/movies-juror-2-justice-for-clint.html,Juror #2 is the film that WB do not want you to see. Airing more times in Hemel Hempstead alone than in the vast majority of the United States; its international release has done tremendously well by‚Ä¶ [+3850 chars],Focus on Other Movies,Reception and Reviews,
Juror #2,"Juror #2 could be Clint Eastwood‚Äôs final movie, so why is Warner Bros. burying its release?","Juror #2 could be Clint Eastwood's final movie, so why does Warner Bros. seem to be burying the release of the courtroom drama?
The post Juror #2 could be Clint Eastwood‚Äôs final movie, so why is Warner Bros. burying its release? appeared first on JoBlo.",https://www.joblo.com/juror-2-release-clint-eastwood/,"Juror #2 could be Clint Eastwood‚Äôs final movie, so why does Warner Bros. seem to be burying the release of the courtroom drama?",Focus on Other Movies,Marketing and Promotion,
Juror #2,Warner Bros.‚Äô Decision to Dump Clint Eastwood‚Äôs ‚ÄòJuror #2‚Äô Is Criminal ‚Äî A New Home Release of His Debut Makes That Case,"A 4K UHD release of ""Play Misty for Me"" provides a timely opportunity to see where the director began and examine how much has changed (and stayed the same) over the course of 40 years.",https://www.indiewire.com/features/commentary/clint-eastwood-play-misty-for-me-juror-2-1235062567/,"Earlier this month, Warner Bros. (barely) released Clint Eastwood‚Äòs 40th film as director, the exquisitely crafted and morally probing courtroom drama ‚ÄúJuror #2.‚Äù Like many of Eastwood‚Äòs movies, it s‚Ä¶ [+12025 chars]",Focus on Other Movies,Broader Industry Trends,
Juror #2,'Juror #2' is a thorny legal thriller ‚Äî and possibly Clint Eastwood's last film,Eastwood takes measured aim at the American justice system in a film that centers on a murder trial ‚Äî and a juror who realizes he may be implicated in the crime.,https://www.npr.org/2024/11/08/nx-s1-5178053/clint-eastwood-juror-2-review,"Last week, Warner Bros. opened Juror #2 in limited release, with minimal fanfare, and no plans to report the film's domestic box office. It's not the typical treatment for a Clint Eastwood movie, esp‚Ä¶ [+4109 chars]",Focus on Other Movies,Plot and Themes,
Juror #2,"‚ÄòJuror #2‚Äô review: In Clint Eastwood‚Äôs intriguing courtroom drama, a possible guilty verdict comes with extra guilt","The movie, which may be Eastwood's finale, isn't flashy or even entirely persuasive in its twists and coincidences. But it's consistently absorbing.",https://www.bostonherald.com/2024/11/04/juror-2-review-in-clint-eastwoods-intriguing-courtroom-drama-a-guilty-verdict-comes-with-extra-guilt/,"The movie, which may be Eastwood's finale, isn't flashy or even entirely persuasive in its twists and coincidences. But it's consistently absorbing.
",Focus on Other Movies,Reception and Reviews,
Juror #2,Is ‚ÄòJuror #2‚Äô Streaming on Netflix or HBO Max?,Clint Eastwood's new legal drama opens in select theaters this weekend.,https://decider.com/2024/10/31/watch-juror-2-movie-streaming-netflix-hbo-max/,"Juror #2, the new legal drama from acclaimed filmmaker Clint Eastwood, is less ‚Äútwelve angry men‚Äù vibes and more ‚Äúone confused boy.‚Äù",Focus on Other Movies,Marketing and Promotion,
Juror #2,‚ÄòJuror #2‚Äô Proves Clint Eastwood Is Still a Master of Suspense‚Äîand Hollywood,"Clint Eastwood‚Äôs Juror #2 is a masterclass in suspense and moral dilemma, led by a powerhouse performance from Nicholas Hoult. If this is Eastwood‚Äôs farewell, he‚Äôs leaving Hollywood on a high.",https://observer.com/2024/11/juror-2-review-clint-eastwoods-tense-thriller-stars-nicholas-hoult/,"In ‚ÄòJuror #2‚Äô Nicholas Hoult, one of the best of the young breed of actors currently impacting the movie scene, plays Justin Kemp, a successful, clean-cut Savannah journalist with a new home, a promi‚Ä¶ [+4147 chars]",Focus on Other Movies,Reception and Reviews,
Juror #2,"In ‚ÄúJuror #2,‚Äù Clint Eastwood Judges the System Harshly","The ninety-four-year-old director‚Äôs courtroom thriller, starring Nicholas Hoult and Toni Collette, shows how self-interested parties can make the striving for justice yield injustices.",https://www.newyorker.com/culture/the-front-row/in-juror-2-clint-eastwood-judges-the-system-harshly,"Its commonplace to acknowledge Clint Eastwood as one of the most distinctive and original political filmmakers. Whats surprising about his new film, Juror #2, is that the politics it brings to life i‚Ä¶ [+9407 chars]",Focus on Other Movies,Plot and Themes,
Juror #2,"Clint Eastwood‚Äôs Juror #2, a morality play for the moment","Juror #2 is most likely the last of the great Clint Eastwood‚Äôs directed films.¬†

He has not lost a brain cell; the film is a masterpiece about the unexpected challenges of the human condition.¬† It is about the wholly unpredictable c...",https://www.americanthinker.com/blog/2024/11/clint_eastwood_s_juror_2_a_morality_play_for_the_moment.html,Juror #2 is most likely the last of the great Clint Eastwood‚Äôs directed films.,Focus on Other Movies,Plot and Themes,
Juror #2,"In Juror #2, Clint Eastwood Puts American Justice on Trial","What is justice? 
For as long as Clint Eastwood has been making movies‚Äîwhich is to say, a very long time‚Äîthat question has occupied him more than any other. 
In 1973's High Plains Drifter, he told the story of an almost ghost-like figure who came into town to‚Ä¶",https://biztoc.com/x/6b1cfce8d2987fcd,"What is justice? For as long as Clint Eastwood has been making movieswhich is to say, a very long timethat question has occupied him more than any other. In 1973's High Plains Drifter, he told the st‚Ä¶ [+140 chars]",Focus on Other Movies,Plot and Themes,
Juror #2,Review: Clint Eastwood makes us think outside the jury box with courtroom thriller ‚ÄòJuror #2‚Äô,"Academy Award winner Clint Eastwood directs his new film ""Juror #2,"" which was released in cinemas on November 1st via Warner Bros.
The post Review: Clint Eastwood makes us think outside the jury box with courtroom thriller ‚ÄòJuror #2‚Äô appeared first on Digita‚Ä¶",https://www.digitaljournal.com/entertainment/review-clint-eastwood-makes-us-think-outside-the-jury-box-with-courtroom-thriller-juror-2/article,Nicholas Hoult in 'Juror #2.' Photo Courtesy of Warner Bros.,Focus on Other Movies,Reception and Reviews,
Juror #2,Juror #2,"Sometimes, they do make ‚Äòem like they used to.",https://www.rogerebert.com/reviews/juror-2-clint-eastwood-film-review,"Sometimes, they do make em like they used to.¬†
",Focus on Other Movies,Reception and Reviews,
Juror #2,Juror #2 Reflects the Major Themes of Clint Eastwood‚Äôs Career‚ÄîDown to Its Unpredictable Ending,"The new courtroom drama, which could be the 94-year-old director's last film, reflects his preoccupations with moral gray areas and justice, down to its somber end.",https://time.com/7106837/juror-no-2-clint-eastwood-ending-explained/,Warning: This story includes spoilers for Juror #2.,Focus on Other Movies,Plot and Themes,
Juror #2,Juror #2: Clint Eastwood's 'cleverly constructed' courtroom drama is 'rock solid',"""What are the chances, eh?"" said Ryan Gilbey in The Guardian. ""First you get picked for jury duty even though your pregnant wife might deliver your child before you can deliver a verdict."" Then, you realise that you alone know for certain that the defendant a‚Ä¶",https://biztoc.com/x/31dc481e7d578962,"""What are the chances, eh?"" said Ryan Gilbey in The Guardian. ""First you get picked for jury duty even though your pregnant wife might deliver your child before you can deliver a verdict."" Then, you ‚Ä¶ [+145 chars]",Focus on Other Movies,Reception and Reviews,
Juror #2,The ‚ÄòJuror #2‚Äô cast still can‚Äôt believe they got to work with Clint Eastwood,Clint Eastwood may be 94 but he's not ready to retire just yet,https://abcnews.go.com/Entertainment/wireStory/juror-2-cast-work-clint-eastwood-115262491,"Nicholas Hoult was certain someone had made a mistake.
",Focus on Other Movies,Cast and Crew,
Gladiator II,Gladiator II Is Escalating the Popcorn Bucket Arms Race,"After the unintentionally weird one from Dune 2, and the intentionally weird one for Deadpool & Wolverine, a new contender has entered the ring.",https://gizmodo.com/gladiator-ii-popcorn-bucket-dune-2-deadpool-wolverine-2000515835,"No modern blockbuster is complete with its very own popcorn bucket. It‚Äôs a trend that‚Äôs been happening for a few years but rose to viral levels when Dune: Part Two released one that, well, looked lik‚Ä¶ [+2676 chars]",Focus on Other Movies,Marketing and Promotion,
Gladiator II,Paul Mescal chickened out of his initial meeting with Denzel Washington on ‚ÄòGladiator II‚Äô,The star of 'Gladiator II' seemed to be aware that he was in the midst of one of the greatest actors of all time.,https://www.digitaltrends.com/movies/paul-mescal-denzel-washington-meeting-gladiator-ii/,"It‚Äôs fair to say that Gladiator II¬†was a big step up for its star, Paul Mescal. The actor leads an all-star cast, and during a recent appearance on¬†The Graham Norton Show, he explained just how intim‚Ä¶ [+1535 chars]",Focus on Other Movies,Cast and Crew,
Gladiator II,"After Gladiator II, Ridley Scott Is Taking Paul Mescal to the Apocalypse",The Blade Runner and Alien director will next adapt post-apocalyptic novel The Dog Stars.,https://gizmodo.com/ridley-scott-paul-mescal-new-film-dog-stars-2000522173,"Ridley Scott is almost 90 years old and the man never stops. He‚Äôs about to release Gladiator II, the sequel to one of his most acclaimed moviesand at one point, he was going to follow it up with a fi‚Ä¶ [+1969 chars]",Focus on Other Movies,Broader Industry Trends,
Gladiator II,Paul Mescal reveals that he won his ‚ÄòGladiator II‚Äô role after a single Zoom call with Ridley Scott,The actor was cast after a single conversation that he said was mostly about director Ridley Scott's passion for gaelic football.,https://www.digitaltrends.com/movies/paul-mescal-gladiator-ii-role-zoom-call/,"Paul Mescal is receiving widespread acclaim for his performance in Gladiator II, but the question of whether he was the right person to anchor a long-awaited sequel was apparently not on director Rid‚Ä¶ [+1418 chars]",Focus on Other Movies,Cast and Crew,
Gladiator II,"Connie Nielsen Worried About The ""Enormous Burden"" Of Paul Mescal's Lead Role In ""GLADIATOR II""",I will be seated for Denzel's earrings.View Entire Post ‚Ä∫,https://www.buzzfeed.com/angelinebarion/connie-nielsen-gladiator-ii,"Connie:¬†The way that [Lucilla]s written is coherent and then the work that we each do, all of us actors, is to bring background, context and to lobby for our ideas which we all did with Ridley lobbyi‚Ä¶ [+438 chars]",Focus on Other Movies,Cast and Crew,
Gladiator II,"An interview with Ridley Scott about Gladiator II, the challenges of working...","An interview with Ridley Scott about Gladiator II, the challenges of working with Denzel Washington & Joaquin Phoenix, Palme d&#82",https://kottke.org/24/11/0045597-a-fun-interview-with-ridl,"√óHello! In order to leave a comment, you need to be a current kottke.org member. If you'd like to sign up for a membership to support the site and join the conversation, you can explore your options ‚Ä¶ [+394 chars]",Focus on Other Movies,Production and Behind-the-Scenes,
Gladiator II,Ridley Scott Had A Hilarious Question For One Pivotal Gladiator II Artist,"When Ridley Scott set out to recruit Gladiator creative Gianluigi Toccafondo for Gladiator II, he started by asking him a rather amusing question.",https://www.slashfilm.com/1702800/ridley-scott-hilarious-question-gladiator-2-artist/,"Toccafondo has mostly been working in Italy, making art, painting film posters, and staying insular to the Italian film industry; he hasn't achieved much in the way of broad, mainstream international‚Ä¶ [+1520 chars]",Focus on Other Movies,Production and Behind-the-Scenes,
Gladiator II,"'Gladiator II' Popcorn Bucket Goes Viral, Escalates Novelty Concession Wars","The popcorn bucket wars are heating up, and they are getting downright extreme ... with ""Gladiator II"" now leading the buttery charge. Here's the kernel of truth ... the elaborate popcorn bucket for the 'Gladiator' sequel just dropped ... it's an‚Ä¶",https://www.tmz.com/2024/10/22/gladiator-ii-popcorn-bucket-goes-viral/,"The popcorn bucket wars are heating up, and they are getting downright extreme ... with ""Gladiator II"" now leading the buttery charge.
",Focus on Other Movies,Marketing and Promotion,
Gladiator II,MF DOOM Fans React to ‚ÄòGladiator II‚Äô Popcorn Bucket Featuring Late Rapper‚Äôs Mask,Gladiator II has unveiled a collectible popcorn bucket that it‚Äôll be offering to moviegoers upon hitting the theater next month: a silver helmet that sits on top of the bucket.The helmet made its debut in the original 2000 Gladiator film on Maximus Decimus Me‚Ä¶,https://hypebeast.com/2024/10/mf-doom-gladiator-2-popcorn-bucket,"Gladiator II has unveiled a collectible popcorn bucket that itll be offering to moviegoers upon hitting the theater next month: a silver helmet that sits on top of the bucket.
",Focus on Other Movies,Marketing and Promotion,
Gladiator II,Paul Mescal and Denzel Washington Hail Ridley Scott‚Äôs ‚ÄòGladiator 2‚Äô in Tokyo: ‚ÄòThere‚Äôs No Better Director for Focusing on an Audience‚Äôs Sense of Entertainment‚Äô,"A quartet of stars, headed by Paul Mescal and Denzel Washington, were on hand Monday in Tokyo to celebrate ‚ÄúGladiator II‚Äù and its master filmmaker Ridley Scott. Mescal, who plays the gladiator Lucius, said that what separates ‚ÄúGladiator II‚Äù from ‚ÄúGladiator‚Äù i‚Ä¶",https://variety.com/2024/film/news/paul-mescal-denzel-washington-ridley-scott-gladiator-2-tokyo-festival-1236199380/,"A quartet of stars, headed by Paul Mescal and Denzel Washington, were on hand Monday in Tokyo to celebrate ‚ÄúGladiator II‚Äù and its master filmmaker Ridley Scott.
",Focus on Other Movies,Marketing and Promotion,
Gladiator II,A Top Historian Isn't Holding Back On Ridley Scott's Gladiator 2,"You'll never believe it, but Ridley Scott's Gladiator II isn't the most historically accurate film ever made according to a major historian.",https://www.slashfilm.com/1702548/historian-not-holding-back-gladiator-2-ridley-scott/,"Remember when the world united around the question of how often the average person thinks about the Roman Empire? Well, it's time to hear from the people who've dedicated their entire lives to histor‚Ä¶ [+1689 chars]",Focus on Other Movies,Plot and Themes,
Gladiator II,The Wicked And Gladiator II Box Office Estimates Suggests One Thing About Both Movies,The box office projections for both Wicked and Gladiator II should come as encouraging news to the studios behind them and theaters alike.,https://www.slashfilm.com/1702497/wicked-gladiator-2-box-office-estimates/,"It looks like Hollywood and movie theaters are going to have a lot to be thankful for very soon. That's because the Thanksgiving frame is shaping up to be an absolute juggernaut, with not one, not tw‚Ä¶ [+2016 chars]",Focus on Other Movies,Box Office Performance,
Gladiator II,Ridley Scott Teases ‚ÄòGladiator III‚Äô Will Be Inspired by ‚ÄòThe Godfather Part II‚Äô,"Instead of releasing a longer cut of the highly-anticipated sequel, Scott is looking to create a trilogy.",https://www.indiewire.com/news/general-news/ridley-scott-gladiator-3-inspired-by-the-godfather-part-2-1235063476/,"Ridley Scott‚Äòs ancient Rome would draw some inspiration from a mafia classic for a possible third ‚ÄúGladiator‚Äù film.
",Focus on Other Movies,Broader Industry Trends,
Gladiator II,"With 'GLADIATOR II,' Ridley Scott Returns to the Arena...","It‚Äôs been 24 years since the director Ridley Scott scored one of the biggest hits of his career with ‚ÄúGladiator,‚Äù",https://dnyuz.com/2024/11/07/with-gladiator-ii-ridley-scott-returns-to-the-arena/,"Its been 24 years since the director Ridley Scott scored one of the biggest hits of his career with Gladiator, a swords-and-sandals epic starring Russell Crowe that won the Oscar for best picture. No‚Ä¶ [+13025 chars]",Focus on Other Movies,Reception and Reviews,
Gladiator II,‚ÄòGladiator 2‚Äô Production Designer Arthur Max Made Everything Bigger and Better: It Was ‚ÄòGladiator‚Äô on ‚ÄòSteroids‚Äô,"Ridley Scott had one directive for production designer Arthur Max on ‚ÄúGladiator II‚Äù: ‚ÄúI want to go big. I want to imply the grandeur of the Roman Empire,‚Äù he told the veteran artisan. Max, who has been Scott‚Äôs go-to production designer for over two decades, d‚Ä¶",https://variety.com/2024/artisans/news/gladiator-2-production-design-arthur-max-colossseum-1236204731/,"Ridley Scott had one directive for production designer Arthur Max on ‚ÄúGladiator II‚Äù: ‚ÄúI want to go big. I want to imply the grandeur of the Roman Empire,‚Äù he told the veteran artisan.
",Focus on Other Movies,Production and Behind-the-Scenes,
Gladiator II,"‚ÄòWicked,‚Äô ‚ÄòGladiator II,‚Äô and All the Films and TV Shows We‚Äôre Watching This November","From 'Wicked' to 'Gladiatior II,' here are the best theatrical movie releases and TV shows streaming online that we're watching in November 2024.",http://www.rollingstone.com/product-recommendations/lifestyle/what-to-watch-november-2024-best-movies-tv-shows-wicked-1235150422/,"If you purchase an independently reviewed product or service through a link on our website, Rolling Stone may receive an affiliate commission.
",Does Not Mention Emilia P√©rez,Marketing and Promotion,
